id,text,polarization
deu_38493a248db5aa13ed03858136ddb554,das hat schon was von fitnessclub mitgliedschaft für dicke sehr verständlich das die mutter da sauer wird auf der anderen seite sind es ja diese verschwörungsgläubigen die bild und afd und ähnlichen rechtspopulistischen mist am laufen halten und ihr ganzes umfeld stressen also mindestens ebenso verständlich dass du etwas ändern willst nda aber lass uns wissen ob deine mutter hingegangen ist vhs ist ja auch nur wieder linksgrün versiffte staatsfunkpropaganda zu wünschen wäre es euch allen viel glück,1
deu_ac32d15cd32ff1e3001b7cdc7a145999,respektvoller umgang krieg ist krieg und immer scheiße und ein verbrechen jeder krieg ist hassgetrieben das ist die natur von krieg,0
deu_988219a5a0da010e40dba4138cedc7f3,aktuelle musik verteilen das ganze neue zeugs ist doch müll früher war musik noch musik,1
deu_0f099409c64ec554952800d17df092be,ich habe aber tatsächlich ein sehr starkes immunsystem was für eine arbeit machst du,0
deu_171593dfb828f0b292ba982c8896df32,es gibt für mich nur ein putin lied putin putout,1
deu_d01a59911b805646bd44708c8bfb9d99,für tage den haag das witzigste ist dass ich den urlaub kurz vor corona gebucht habe hab bis dato noch gar nicht von corona gehört na ja auf jeden fall hieß das hotel boutique hotel corona,0
deu_04852440eaf013080ae86eedfc81b9e8,oh nein putin macht putin sachen wie auch immer zurück zu meinem toastbrot,1
deu_53558ab74932bb644b09f65745bc4f4b,außerdem wurde die prüfung der impfung über die angegebene chargennummer des impfstoffs durchgeführt,0
deu_dd5d338591a2646c317ba5e4283ab437,klar querdenker tragen so zuverlässig masken wie die polizei waren immer alle vermummt,1
deu_4e41f96cbe6b8dda857714e93d6dd2b6,löschdecke und am besten ein co feuerlöscher,0
deu_80b5c44edd5624d9898dc52eba0a8227,co ungleich wasser schließlich baden wir nicht im deutlich mehr vorhanden salzwasser süßwasser geht immer mehr zur neige und sollte ebenso wie co im verbrauch verringert werden,0
deu_1e16fff02a187b34d514c4602c8fd648,wäre es abwegig anzunehmen er könne mit dem hi virus infiziert worden sein,0
deu_5790568301a5e04ff73626728ebd7d17,ich glaube woke menschen haben ein überproportional großes sendebewusstsein gesehen werden ist auch irgendwo ein essentieller teil des woke seins dazu kommen natürlich noch die filterblasen,1
deu_8352a7696661eea99a3f78c3d60bcc82,kann an der impfung liegen,1
deu_62941d4539ceabc01f25123d2b10a8dd,dann hätten wir asyl mutti behalten sollen,1
deu_d2bc05e72983fa2065beec7a211c2880,der titel allein ist schon so dumm zu woke als würde woke nicht einfach bedeuten dass man sich sozialer misstände bewusst ist und die versucht zu verbessern wenn man jemanden als zu woke bezeichnet impliziert man damit dass man gewisse soziale misstände gut findet und sie beibehalten möchte,1
deu_b4664ee7565013a5739bc1d1d63ec3e0,israel gehört zum nahen osten,0
deu_9896da7dd3f6fdeef9f70eee07bc2ea2,und dein argument ist dass dem klima geholfen wird wenn luxembourg pro kopf emission auf indiens pro kopf emission zurückgeht ja rechne es einfach mal durch eventuell kommt eine erleuchtung ich erwarte es allerdings nicht bei deinen saudummen posts,1
deu_cbb5faa378a7389b3ecd675faf5bfe85,früher war alles anders manches war besser manches ist heute besser,0
deu_1ba7d7011f6e07084604dae4a2f3ce8c,ihr wollt den totalen krieg,1
deu_f6a74084cde1d9d287be60ec51c63a47,höcke putin pakt wann,1
deu_d28ce433b70adbe48f46dfe920fb4894,assumest du gerade kreplklaus sein gender,0
deu_ecec265f939041d00c6f5ea4a76c729c,es ist hier extrem wichtig zu wissen ob du die ukrainische staatsbürgerschaft hast wenn ja dann würdest du möglicherweise eingezogen werden die ukraine kennt und erlaubt keine zweite staatsbürgerschaft wenn du sie ukrainische durch geburt hats dann interessiert es sie nicht ob du auch eine deutsche hast vielleicht vorher mit der botschaft konsulat abklären,0
deu_da20f0b2b2e15ea78ea83423e6910f5a,hat die ausgrabung auch etwas mit jüdischen personen zu tun bzw wurden jüdische artefakte etc gefunden die aufgrund der pest verfolgt wurden,0
deu_e8cf533f8ce073526aaa7ab56ed833fa,in den usa ist alles links von trump woke,1
deu_72ef41625c51993c9d6bb5908dddad45,bund scheinheiliger wichte,1
deu_416f4493bfd2f83c57be82986a40c7dc,no ist russische infrastruktur die russland gehört,0
deu_74cabc2e4ddf0a3d6aa72935d55e9db7,und dann die schreien dich trotzdem asyl und müssen reingenommen werden,1
deu_5f0259f14d5e2c55f4162bcf8df6e3b0,weniger vergewaltigungen und verschleppungen bleibt die ukrainische armee in kiew,0
deu_eeb7878f96a7b1d021734340e15f7f13,vom regen pandemie in die traufe weltkrieg,0
deu_c89a96648e5a0f8db25f2ddcd7df4626,israel bissle gebiet hier genommen eine häpple hektaren da dann israel bissle schockiert wenn bumbum passieren tut,1
deu_f6d2de651ff19c2c7a912fc26a2a97e1,nö das ist kein bs die aussagen viele islamisten wollen wollen juden ausrotten und viele nazis wollen juden ausrotten können gleichzeitig wahr sein darum ging es in der ursprungsfrage aber auch nicht,0
deu_be838009a7027aca682d35538da9cfef,hallo letzte generation ich hätte hier ne zielliste bei der euch sogar die suv fahrenden massen unterstützen,1
deu_448e3b0a085daeec36e0ee143c3e9e80,boah in letzter zeit nur noch ausländerfeindliche artikel hier gerne mal von ex bild redakteur julian reichelt und seinem pleiteticker abkopiert und jetzt noch mehr in richtung die armen impfgegner querdenker daneben noch leichte garnierungen von das arme russland die brd ist ja der wahre kriegstreiber und amerika war ja immer viel böser dazu ein sahnehäubchen von wagenknecht und schwarzer sind ja größten und auf ihrer demo waren in wahrheit viel mehr leute leider inzwischen nur noch der rechtsextreme abschaum hier der auf r de zu recht rausgeschmissen wurde reicht bin raus hier behaltet euer rechtes loch,1
deu_e6288fb9a294fc10f0438793b766a083,letzte generation und deutsche umwelthilfe werden verboten gefährdung deutsche wirtschaft,0
deu_f186b5ad9086a30e64ae7f4cf422b5d8,das wort mit m was putinsknecht sucht ist moskau moskau oder meinungsfreiheit,1
deu_ad612c6e17e92143d9cda95c2712b4b0,technischer einkäufer vorrangig für maschinen fff kfz ect,0
deu_ada37a6b4085613d972bfd427e4d06ba,essay definiere das wort woke und erkläre dann was eine neu woke phobie ist,1
deu_1734f3b65f966b8b1ca6fb22a18712fe,duh kennst du ein paar schöne beispiele ich bräuchte mal eine gute umweltinitiative die ich etwas deutlicher unterstützten könnte,0
deu_37bd488c31203d20292b7b79b17cf5ea,ich glaub nicht das rechte und querdenker nazis töten würden aber gut,0
deu_d0a4ba5b3dff168825258aa7731066d1,momentan werden im jahr unter euro pro flüchtling ausgegeben davon wird alles bezahlt das essen die unterkunft sozialarbeiter ich kannst du von euro im jahr leben dachte ich mir,1
deu_05afdc635cc4181122b0917c27fdfe76,nie wieder geisel austausch innerhalb des gaza streifen sowas darf nicht nochmal passieren,0
deu_d28ccf576e205c6d932728de4c5ba2f7,wenn hamas sich unter zivilisten versteckt ist hamas der kriegsverbrecher,0
deu_31bbd0e38947db7527cd108fd0f91154,ruhe in frieden uns uwe du warst ein guter,0
deu_390f4145b2a1659809b0c866a6d280af,lustig sowas am tag der lützerath demo zu bringen,0
deu_c12d0aa17ae9e4e3cfa6cebea7de864e,bahnstreik an ostern warum hasst die bahn das christentum,1
deu_e7c08c7b00b53b17849de17466a7203d,wie ist denn die stimmung ist es das erste mal an neujahr in kiew wurde viel gefeiert,0
deu_b997338f5d83f4d2e7aac8f2bec9a9a1,faschismus ist eine ideologie für bullies wofür sind kinder und teenager bekannt,1
deu_abcfcd8b3266377b721f74577897625c,angeblich ein größerer nutzerzuwachs als bei covid,0
deu_b7b828dbd80795815ccefa1132b33be5,selbstverständlich geht das auf das konto der hamas,0
deu_7fe645744fe9881b641d05d77b222954,melnyk ist ein widerlicher faschist der aus einem land mit einem mindestmass an selbstachtung längst ausgewiesen wäre,1
deu_f78747b7957e3c108ab0701a3d282ac9,es gibt bei demonstrationen keine kontrolle darüber wer was für eine fahne mit zu einer demo bringt der veranstalter hat selbstverständlich das recht menschen von seiner demo zu verweisen wenn er sich das nicht traut gibt es dafür in der regel polizeipräsenz oder zumindest die möglichkeit das mal von der bühne anzusprechen auf einer demo gegen rechts würde ich das erwarten,1
deu_097a87ccfabd4b5d64bfe93561ab81e1,reiche leute ideologie der sitzt,0
deu_d6744212c7f5206fe6e1357a271f749d,die gender debatte ist schlussendlich teil eines größeren kulturkampfes diese konversation wegzudrücken weil es doch nur um gender geht ist kurzsichtig was momentan stattfindet ist eine grundsatzdebatte über identität und die leute werden radikaler auf beiden seiten,0
deu_d3b60b04bd6364c9d1117adadaea3d04,archiv zentralrat der juden fordert von fridays for future umbenennung,0
deu_597775594e8c6a31df16381229d3825e,kein diktator kein autokrat kein general kein kriegstreiber auf der welt schaut sich dieses bild an und hat einen come to jesus moment sie wissen was sie tun sie stört es nicht manche finden es aktiv gut,1
deu_36d6846f33c06698e463f3758b70640f,ich verstehe das argument mit corona nicht naja es soll leute gegeben haben die hatten,0
deu_bb95e00734abe6ffdd2505b8af9d0b8b,nicht als antisemitischer pro hamas scheiß,1
deu_7a45e4aaec5f38750fbca618baed3727,corona was ist das denn,0
deu_291f55e39df12f5e78bbd507544f8c64,nur weichgespült für leute die das wort faschist nur nicht so schlimm finden die auch gerne faschisten wählen,1
deu_fbe91bbf5fc9cb662cb364a8e64c5950,wir verbrauchen zu viel co wie erzeugen zu viel co die anlagen benötigen energie und erzeugen ja schon in der produktion eine menge co,0
deu_7b68df83f189d0d1bbc1d60017327a70,wertkonservativen eltern ob man diesen euphemismus auch verwenden würde wenn die eltern religiöse muslime wären,1
deu_a4f5213845f45f3abf18985184872ec8,so etwas wie die angedeutete immunschuld existiert nicht das coronavirus schwächt aber nachweislich das immunsystem auch wenn es selbst keine symptome hervorruft,0
deu_6477212b012fbad973cee4041172bc0c,naja die letzte generation hat doch genau das angekündigt,0
deu_8c635b06773455598d38caac859a2290,zumal ja noch der verdacht im raum steht er könne als flüchtling aus syrien hergekommen sein junge,1
deu_b156c91e7c11468a5d4cbf962782caf4,die afd reitet die welle der migration es gibt keinen wähler block mehr der zu mehr als gegen weniger migration ist in jedem wähler block wollen mehr leute maßnahmen gegen mehr migration und solange das niemand durchsetzt wird die afd das weiterhin melken können,1
deu_4cae22b10a800e92e30c4a8d45a5c7fa,wir werden neukölln zu gaza machen sie fordern einen zaun,1
deu_46367e131de7ab04a7e481899b3fa922,russische fenster waren noch nie die sichersten,0
deu_d6206a0ed869c16e20d3679feffa3b10,heimat umweltschutz sind ja nun auch wirklich verschiedene paar schuhe das weiss man doch als alter ignaz,1
deu_d84c49274a330a0312e79c74296d2f4e,die linken mods dieses sub ist jetzt woke,1
deu_b8b5919cab7e7e89cb29b33e8fdcdb15,bitte krieg keine kinder,1
deu_9315a6150f2e311c2d44eab0e2bf0c55,krankheit krieg kackwetter,0
deu_ea2e4f5a09de6e74f640e144684f804c,ich hoffe sie gewährt in zukunft den wirtschaftsflüchtlingen aus deutschland asyl,0
deu_7987ccbfecf81eeee049f5570896a8d4,es ist ne verschwörungstheorie das hocke faschist ist und die afd ihn weiter hält alles,0
deu_8ce6cdb1f1927bb35ef29b19e9ca9ab0,wann neue impfung legal,0
deu_43fad0cc350fdd0a6686da292de8cc72,es geht um die corona impfung also ist es wahrscheinlich ein scam,1
deu_2e6dc9aba69a3f5445ebe71e64ddf3a7,für putin nicht,0
deu_16a9517d9d422e5e5e61c13edd9843ac,termin am freitag seid dabei,0
deu_e2239f57b5313044d8b97c1cf58da1b9,für anti gender studies,0
deu_fab244cbc6828071441e72bfc3f98223,was immer das auch sein soll populistischer wahlkampf im konservativen milieu,1
deu_1528f251696e090a1eafed1f9fef24a3,war biontech vor der corona impfung nicht relativ klein und kein big pharma,0
deu_4ecb1b447aa968b6ec056363a4cc1d63,ich gebe dir vollkommen recht das beste daran ist aber dass gleichzeitig allerorten von einem linksruck im land und in der cdu gefaselt wird der angeblich unter merkel stattgefunden hat alles bleibt so wie es ist und wenn die realität doch mal anpassungen erzwingt wird das als annäherung an linksgrün,0
deu_d652bafecbcde36e9bb4fc0f90971791,co kapseln schnüffeln,1
deu_94c84f008752bc4cd61347f520d9b944,technischer verwaltungsbeamter beim bund,0
deu_aa10d04d50b2b336d412ca3780bc459f,demonachlese mit ein paar tausend antifaschist innen für und gegen auf den straßen von,0
deu_c9f6a3c045d6cee18da58c129a6751d6,ich sehe überhaupt keinen misserfolg ich habe erst heute die nachricht gelesen das städte von der gruppe wagner eingenommen wurden und das raketen in kiew eingeschlagen sind klitschko der bürgermeister hat diese meldung bestätigt also wenn das misserfolg ist hoffe ich das putin sich nicht bis nach berlin misserfolgt,0
deu_83ddabd1fe87f0e26b3ff65790b8443f,das komische ist das die letzte generation das anscheinend in der stellungsnahme verteidigt,0
deu_a09f7b2c4860e59aca8ef8325ad7a668,tausch autonomer gegen islam wird interessant,1
deu_bf0680a65cb9e41f39bf3110e04649a5,wie krieg ich den job,0
deu_8f040a5ab7be5c9a1f5f9689fe71b802,und von jeder linken demo,0
deu_3be43bab4cd22153fa5d8c81e46dfe02,mir deucht so ganz grob zusammen gefasst gibt es in der bevölkerung genau begriffserklärungen für querdenker und darin liegt der hund begraben,0
deu_91e48dc55e65edeb5186b43520149bb5,die sollten es so lassen als mahnmal dass man jahre lang den klima und umweltschutz vernachlässigt hat und massiv daran beteiligt war diesen planeten zu zerstören,0
deu_a3dcd1996d8c09846d3568b12600ca94,vor corona ab k während nach corona ab k,0
deu_813487b92082465778057fe96e85973a,und danach hoffentlich anglizismen du meintest wohl gender unsinn,1
deu_16ada34bde88e51799b5f28471bc5b89,pfft bissl militär dann gehts schon wenn ne wichtige deutsche person dort als geisel genommen werden würde was meinst du wie schnell die scheiße am dampfen wäre sachen wie evakuierungen etc wären defintiv trotzdem möglich wenn auch mit größem ärger wäre aber verdient und muss so,1
deu_3d251091a4a33d5393c68a8cbbd5b973,russland ist anti woke anti queer anti kolonial anti westlich anti amerikanisch anti kapitalistisch anti xy für jeden etwas egal ob linke oder afdler hauptsache nützliche idioten für putin,0
deu_1b5196353b6b1350c9e48f9e6e09fc43,ja alles araber bzw maghreb ergo weniger konflikte untereinander als zb zwischen türken kurden arabern oder persern,1
deu_96179786ca25e910c4f5a3aa1e352640,worldnews ist meist isrealfreundlich die hamas propaganda gibt s auf news,0
deu_a1278f484a87e5080a3b94c24f689ba6,maskne das gesichtstattoo der pandemie,1
deu_a31c2117483687c86acca54b1d935527,so wie damals mit der ukraine,0
deu_687e0ddf3219ffa685eb5b21429ab5e3,woke ist wenn die grünen,1
deu_3fc9be8141df2cf038b14cadec87efdc,denn wir wollen den totalen krieg,1
deu_aeb04f38a9638aed0bae7f2992938ffd,hamas hisbollah und co sind sehr wohl rechtsextreme,0
deu_6fecb187846cf8c8c1315796e0a8dc86,lololo die bösen ausländer sind schuld natürlich,1
deu_f2aae274f0699804096a0747da98696b,ein rundflug von mexico city nach hamburg stößt etwa co pro person aus das ist mehr als die jährlichen pro kopf emissionen von ländern,0
deu_57ba2c8d042dab8493e6f25c7a6ac47e,nichts materielles ruhe frieden entspannung erholung,0
deu_8a7092fdcea5e2105755546b40ac3a1b,parkraumbewirtschaftung ist halt auch nicht wirklich umweltschutz sondern primär einnahmequelle für die stadt,0
deu_353d221513585a8ade0eaa0536e32149,immer dieser gender wahn s,1
deu_b668acecd4107e91867a7a1696b8ca27,ja und ausländer und frauen,1
deu_f9fcb57b000e9702b89509f4e17b06a0,oh schau mal das russische geld spricht,0
deu_3564b1633cd2433c5c8c6d6288e5832f,du meinst doch sicher mehr islam konvertierungen oder,1
deu_a279b1368cea7959c6ce926091f59202,was haben juden auf einmal damit zu tun,0
deu_201b2aaf37ebc81756f65e2bd77d3ca9,du zutiefst rassistisch statt primär zu sagen es gehe um fremde männer hebst du deren herkunft hervor afrikaner araber,1
deu_39f70a909547806d565f0ec7f0525f79,da israel nach diesem vorfall sicher im gaza aufräumen wird ist es um die menschlichen schutzschilder so meine befürchtungen leider geschehen gaza hat die hamas eigenwillig gewählt die meisten unschuldigen in gaza wollen einen palestine state auf dem boden israels israel wird sich dagegen wehren,1
deu_69d840f3b5549c1d845a5d7cd7298957,arbeit brot und frieden,0
deu_aea0554a6820502ae59dd9fd02c5c95a,ideologie statt vernunft,0
deu_638f8f10c565e456a1f36dc62e96de9a,ja aber den medialen und politischen aufschrei gibt es doch nur bei der habeck fähre der rest ist in ordnung und ein bisschen blockieren und freiwillig nach einiger zeit wieder räumen ist meiner meinung nach auch eine ganz normale demonstration,0
deu_8c2ede1223d3023a166650941294fb42,russland hat mich reagiert russland hat zuerst gehandelt und den pakt gebrochen,0
deu_fc00270bd38d12cf03e1c2658989a9d5,wollen wir ne demonstration anmelden gegen die einschränkung der hot chip challenge für unsere freiheit,0
deu_693f9e1f473e137025db7e6d53776716,ballmer ist doch kein faschist und gemeint sind die orlando magic die der devos familie gehören beide wagner brüder spielen da,0
deu_56f06b72dea64a4a9f2f419e7ba0f4a4,klima ist ja keine krise,1
deu_8eef780f7f3309c6d4cd979c402f6120,ich war jetzt vor ort das klimakamp ist nicht die letzte generation und die veranstalterinnen lehnen den begriff klimakleber ab,0
deu_bdad73fea6b684726cd8740f5e02d4e1,geh doch nach russland,1
deu_8838eaf414b9290d52d323896b0c2df2,es wurde auf einmal sehr ruhig da die ukraine nicht aus jux und dollerei raketen verschießt sondern um ihre existenz kämpft ein unfall wie er täglich überall vorkommen kann hier leider mit einer abwehrwaffe du kannst hier bitte nicht ernsthaft mit einem maß messen es gibt einen kriegstreiber und der heißt russland hört russland auf ist frieden,1
deu_d94ab07a8482e1c31382eabafdc071fe,alles,0
deu_323190490607f4cd5ea72005857c9269,du hast woke und sexistisch vergessen,0
deu_37a16b7577c57c41c1fd0b5d7860f16d,mama ich will krieg und frieden haben wir haben krieg und frieden zu,0
deu_46533f18c4dc711d0354b97a21e95f10,unsere bnd wusste von dem angriff von russland deswegen war der bnd chef am in kiew,1
deu_7713bfd2c87657d1bafb4649b86dae5a,ruhe in frieden big tasty kritiker,0
deu_053627133c173c3eb1ace85e15403e85,der bums muss zu aufgearbeitet werden fehleranalyse für die nächste pandemie,0
deu_bfb81989113c7df210fd8559c3007677,wir sind längst direkt vom krieg getroffen es ist nur kein krieg in klassischen sinne sondern im informationsumfeld,0
deu_2718c6a0b9e17b693bb1ebf4b7b2497d,hilft dem klima genau,0
deu_032c07b5adb4e0ed48dbd31d4497e4e8,ausserdem werden mitglieder der lgbt community in gaza umgebracht,0
deu_0033bf0fd3726681fc5c746f3f7accdf,ja genau nur linke gewähren menschen asyl und islamist steht immer groß auf die stirn geschrieben,1
deu_c0a6cef633e75b358380fe4161cab85b,russische kriegsführung und russische kriegsverbrechen sind so untrennbar miteinander verwoben dass sie synonym zueinander stehen,0
deu_4de4f53c6194f36b55fa2d9e371d49d9,ich will mich jetzt nicht großartig weiter mit dem fall befassen aber kann mir wer erklären wie zur hölle man mit dem auto einfach mal in eine demonstration gerät wenn man sich fahrlässig in so eine situation begibt müsste das doch dein recht auf straflose selbstverteidigung ziemlich beinflussen,0
deu_df0bcebea22ac943a9eb695184ccd784,ein queer verein ist kein öffentlicher csd mit allem drum und dran mein freund,0
deu_f673726aa42c5708b0083487e2a646cb,ein mal mit profis duh,0
deu_bd617c39e1d00ff21c89b11cc7823447,das grinsende gesicht von jörg asmussen gdv ist der grund wieso wir kein gutes nicht versicherungsprodukt für die altersvorsorge bekommen interessant am lobbyregister greenpeace und duh haben jeweils nur lobbyisten die kriegen richtig return on investment campact hat dafür einen der größten millionen etats in deutschland,1
deu_a854cddf7b42b16c3963041aaa951730,aber der staat dürfte kein interesse an einer neuen pandemie haben die wird deutlich teurer,0
deu_f54607788caba48e017b00dafdc20745,alternativer titel grünende entscheiden sich für ideologie statt kompetenz,1
deu_daf780cff4eb9a9cf8503359bac10736,somit sind städte die mehr nachbargemeinden eingemeindet haben also besser im hitzemanagment köln hat durch eingemeindung seine fläche in den er jahren fast verdoppelt schneidet dadurch im duh ranking besser ab das ergibt so mäßig sinn,0
deu_465c1765ce14e141ea5d7fffc4ba7891,nein frau bleibt frau transfrau kann aber lässig als tfrau abgekürzt werden,1
deu_a730692b40af4da7ce25334f23d03fd3,musste leider mehrmals bei pazifische muslime lachen,1
deu_3b4a60160bf5ff0383c604d8c25a9129,ich freue mich immer wenn faschist innen sterben,1
deu_302aa8da44e5f0193985d235c4007c94,gt die situation ist inakzeptabel sagte der liberale pascal canfin über deutschlands blockade der eu entscheidung der franzose betonte er könne nicht akzeptieren dass die fdp den bereits ausgehandelten text als geisel nehme ist ja so ziemlich modus operandi der fdp siehe selbstbestimmungsgesetz das eigentlich ende letzten jahres in die abstimmung sollte und nun seit monaten beim buschmann herumliegt und darauf wartet dass er es freigibt,0
deu_b7d56dabdbb9d28ac80b54ec51b2f25c,was herrscht in den köpfen der hamas strömer,1
deu_b998702fd8794811d71acf0c77f72cea,völlig normal für den islam der super tolle vorbild prophet hat seine jahre alte frau aber erst mit jahren ge ist das nicht eine tolle kultur jaja der islam gehört zu deutschland,1
deu_0319adafdbac30877e2944e8c0e8e0b2,hamas ist die defacto regierung gibt gar keinen unterschied hamas palästina,1
deu_afb41ca639f4db7c6dfb8051b12f0cb1,darum geht s nicht nur darum dass es für den iran nichts zu gewinnen gibt wie chancenlos die sind zeigt doch der tod des hamas chefs kurzstreckenrakete aka das flugzeug von dem die rakete kam haben sie nichtmal bemerkt gute demonstration davon wie unfassbar unterschätzt f sind,0
deu_4916cc335636a62423e48d2476dcc3d2,jaja das jüdische viertel in jerusalem hat sich durch zauberhand geleert genauso das jüdische viertel um das grab von shimon hatzadik alles durch magie wenn die araber schalten und walten aber das gleiche bei juden ist geplant und böse,1
deu_0919c161465e3724582815692727c223,israel gewinnt,1
deu_43e99020d6681ea736df7a94ef50ba60,hihi go woke go broke,1
deu_307f4b00779bf323bb0961b84247a269,warum schwarz rot gold steht eigentlich für das gegenteil der afd ideologie,1
deu_c8c71acef77c95d013a6e1c6e9a2e362,ist doch so aber lieber alles auf covid schieben,0
deu_ce8bbfef9f88b7981a64ac2fe1a13e4d,krieg krieg krieg das sind die grünen,1
deu_e95edc646d24e4baf92d095972157ad6,corona war nicht unbekannt,0
deu_fa1b4e071f7f387143e9573d0c7012c3,wir haben mal ein gehäkeltes corona virus als schlüsselanhänger bekommen weil wir trotz corona normal gearbeitet haben zahnarztpraxis war auch irgendwo süß,0
deu_a7908d994b894fe44829b70b2d11232b,kein frieden unter den nationen ohne frieden unter den religionen kein frieden unter den religionen ohne dialog zwischen den religionen kein dialog zwischen den religionen ohne grundlagenforschung in den religionen weltethos digga,0
deu_6b3624f51faf66e3f5e80ca6b1dcbacc,davon ab warum macht israel als asiatischer staat da überhaupt seit jahren mit weil israel mitglied der european broadcasting union ist,0
deu_103c8dea9b8e34b68b9a078f575e7dba,haben wir doch richtigdenker woke vertreter der aktuellen,0
deu_ee5dda82d5d23a53fcb95b39528cfd06,bist du denn ausländer s,0
deu_cb348f64d2102e06603991bb34b459bd,menschen die straftaten begehen haben das recht auf asyl verloren ganz einfach,0
deu_6aee1a16efa631935191e50508bd5c6b,jemand der von russland bezahlt wird steht zu russland welch eine überraschung,1
deu_3e4b60a1f4b04c9a1ed33f3c447cd785,das schlimmste daran ist dass es erneut von rechts instrumentalisiert wird um gegen ausländer und muslime zu hetzen obwohl er gar kein muslim war,0
deu_4b10d4f84bd9b3cc0b8668a39118b129,wo sind die politiker und ihre bekenntnisse nie wieder warum wird diese demonstration nicht mit wasserwerfer und polizei aufgelöst und die veranstalter zur verantwortung gezogen wo sind die gegendemonstranten die immer gegen rechts demonstrieren wo ist die stellungsnahme der politik was ist mit voller härte gegen antisemitismus,1
deu_661819040981e8446a28d631a9556093,es muss nicht sein das ist richtig aber nicht alles was im bereich des möglichen liegt ist eine vernünftige annahme und wenn sich herausstellt dass long covid symptome auch ohne covid erkrankung ausgelöst werden dann ist der zusammenhang zwischen covid und long covid vorerst nicht bestätigt und wir können ihn verwerfen bis jemand einen aussagekräftigen statistisch relevanten zusammenhang herstellt,0
deu_a70ef6996a0c85b43d0fdb1b8fb5f13e,nur findet im gaza kein genozid stat,0
deu_cfc2c780ce7925c68d0f9aa38d5e9ac8,ausländer raus ist halt wichtiger als gerechtigkeit,1
deu_306f734d5192e38ed44adf6dd340f6ac,hamas begeht massaker und hier klatscht man,1
deu_21060fa3cf2f0f283d3d7616ab01aafe,die letzte generation ist eine gruppe welche andersdenkende mit passiver gewalt in ihrer bewegungsfreiheit einschränkt das sind keine opfer sondern täter,1
deu_b5132eb46e07d3c0643781e2f1a75404,ich verstehe gar nicht wie man sowas fordern kann diese muslime versuchen ständig unsere roten linien austesten,1
