id,text,polarization
deu_c239695df8dc179bea94eb0ec620372f,plädiere für die letzte generation wirft bagger in einen pool kartoffelbrei,0
deu_bb9956c8c06105830d512665f37809e7,ich sach nur klima referent der fdp,0
deu_1726bea18494d8f89f872d6bd025906a,bund naturschutz oder bist du jetzt soldat in,0
deu_913ee8eee21f258be3c699e2e91af646,nein du meinst die kaiserlich russische armee,0
deu_b8f2eabb625259786b94d169eb407dbd,also sollte es legitimiert werden dass ukrainische bürger vertrieben wurden und deren besitz an russische einwanderer gegeben wurde,0
deu_32b8cf40da3bec3d33fa2be03592d0d0,bald impfung für arme individuen,1
deu_bb92b0bceb574b93d826db83c0d0304a,die diskussionen um covid,0
deu_1e3c4098c55fe658f0cec33c70fe12cc,die afd ist immer stark im endspurt vor allem wenn wahlkampf ohne maßnahmen möglich ist,0
deu_84b2d73bb802134c5eb064693f1a5102,und der rest von putin,0
deu_cde31d1b0d3634b7a80feab6318918e7,nein machen wir nicht das problem ist nicht dass irgendeine böse industrielobby den umweltschutz verhindert das problem ist dass die überbordende bürokratie und nimbyismus sowohl die industrie als auch den umweltschutz ausbremsen jede veränderung des status quo wird effektiv verhindert,1
deu_8a7c08659b4c0d981d2346e493ee2175,israel ist halt nicht in deutschland,0
deu_ed60059e6ca52fc5be805996ae1b947a,hallo wir sind die corona band,0
deu_1be10e13e29cab2f267a69fdc47ccf3a,das ist wortwörtlich ein teil des programms der hamas was hat das was die hamas will mit dem post zu tun auf den du reagierst,0
deu_5c65b39f8538b91c2f05de3260cc3f31,co preis steuern um das klima zu schützen das reguliert sich doch von alleine je mehr co desto schlechter das klima desto mehr tote desto weniger menschen und weniger co mann muss einfach nur warten,1
deu_01e2c81e1a1750393b40a40ed9ff3a23,slawen ab in die ukraine,1
deu_32db63e6e0303fdf39653d17ff14a840,stimmt wenn du von mehr dreck ausgesetzt wirst entwickeln sich weniger allergien und dein immunsystem wird stärker,0
deu_05437fdcc9fec0c85daf720a1f7a4865,geh zu älteren frauen die sind weniger woke und empfänglicher,1
deu_835966fe7c1c99c0a237b687cf5955b1,islam ist auch eine primitive religion und sollte so wie jede religion verachtet werden islam ist krebs,1
deu_dce68dc0b694ecd3e1deca337c0a3be6,alman ist das türkische wort für deutscher wird oft abwertend von türken benutzt,0
deu_a29d3b1d398f4e788ecedaf1fef46b07,geht meiner freundin auch so sie ist mindestens generationen zurück verfolgbar aus sachsen aber sieht eher richtung türkei balkan armenien aus araber sind immer megafreundlich türken sowieso sehr seltsam,1
deu_0253affc6d12fbda3f68735112a2d5f9,man habe nichts anderes als diese entscheidung erwartet so duh bundesgeschäftsführer jürgen resch wenigstens das gericht noch etwas beschäftigt die kosten kann man ja dann an die s kostenexplosion dranhängen s,1
deu_b0e1d51c109bc558b5a6dd3510dca900,danke also die zahlungen die angabegemäß nie die hamas finanziert haben sollen künftig wegfallen damit sie nie die hamas finanzieren,1
deu_bcab3f634353484bf09d33755e64e07e,wenn das lemma linksgrün oder gleichbedeutende lemmata im satz auftreten es gibt mehr als genug das an der aktuellen bundesregierung kritikwürdig ist aber das was denen als linksgrün vorgeworfen wird pickt sich lieber die gammligsten rosinen raus,1
deu_ee5b9153c2ef29ce7c43847898d92525,lasst doch dem armen bernd seinen frieden,0
deu_3789e7b6215071c6b03df514fc20f2bc,danke helfershelfer dein putin,0
deu_148eaf9cb5923ca66116d9480f9bfb98,habe mir die beiden fox moderatoren mal angeschaut der eine von beiden scheint einigermassen in ordnung zu sein wer martha der januar coup ist eine friedliche demonstration maccallum oder bret wir können nicht berichten dass biden arizona geholt hat weil unsere zuschauer dass nicht akzeptieren werden baier,1
deu_d3d31bf1fe98d8b6286e4f0ca8cb39dc,sind türken ohne türkische staatsangehörigkeit trotzdem türken,0
deu_d35362be715cb7bd50599785d66faacf,bis zur nächsten pandemie winke winke,0
deu_fc45ef0a2192065afa3097ab7f8a7c65,faschist oder faschist die republikaner haben die wahl,1
deu_b68eaeba2f8669b09c4cfa09561e76ee,der einzige rat der mir einfällt katze behalten und ihr ein schönes gutes zuhause bieten wenn assi nachbarn fragen du hast keine ahnung wo deren katze hin ist du hast diese katze adoptiert,1
deu_bb78c9998157bf38d5d4d5e209cb315b,naja jüdische weltraumlaser sind schon weg,0
deu_c6f53cdebe7fbc463fe43f5ec29a0774,bomben auf nazideutschland haben durchaus frieden gebracht,1
deu_76dcc8b03a227314a388693b6fbce11a,er sagte weil wir in einer großstadt wohnen und der umweltschutz sich auf der kopfhaut absetzt,1
deu_41af66574f1e249442e6ee8c4fd571ad,in gaza gibt es keine zivilisten so einfach ist das,1
deu_affd40e937ae169159b1ae208ea9ee23,der okzident war ja scheinbar überhaupt nicht repräsentiert auf dieser islam werbeveranstaltung,1
deu_67d8773608df9ae812417315f83e0760,ganz einfach fff dax konzern also ergibt keinen sinn aber das ist wohl die analogie,1
deu_1f60e8220924d9605cd7913d2c441279,ist quasi der selbe virus nur ein anderer stamm ebola wurde damals zuerst in marburg untersucht deswegen der name,0
deu_bb94259a67ead8742fe1a0205cd4ae1e,doch anerkennung der covid infektion aus legalen gründen und falls du post long covid entwickelst,0
deu_a92c543463690a04145fccc2b68ae498,demi kurz für pandemie für einen hund hat sich die zugelegt am anfang der pandemie,0
deu_9e7e3e8c4aeb8f48eccbe030a3332e46,geht noch einfacher pass wegschmeißen und dann asyl rufen kriegst alles,1
deu_df0a1182d8ce836e3d1c16dfb89b9c78,geil krieg kinder lieben krieg,1
deu_0c96218a10a7be379ae70ce7dedec508,ach wayne die einzig wichtigen probleme sind doch migration und bürgergeld,1
deu_63bd72989c1bb6969de015765de1edb1,im artikel spricht selbst die duh nur von einem drittel,0
deu_8a74320cb54c2ee4d0491c542bd57c62,wie entkommt man dem flüchtlingsstatus das müsste man unrwa und syrien libanon jordanien fragen hier bekommt man als flüchtling nach circa jahren in deutschland die deutsche staatsbürgerschaft ein palästinensischer flüchtling in syrien libanon aber nach jahren noch nicht im gegensatz zu unrwa setzt sich unhcr dafür ein dass geflüchtete eine sichere heimat finden wenn eine rückkehr nicht möglich ist unrwa hat daran aber leider kein interesse,0
deu_3af8fdc8fbe9b70ee22bb72553d54c64,ahh einen türken des ziegenfickens zu bezichten kein rassismus hier nein nein,1
deu_eda46892e35dc7ed7e693552579ff5f6,und es redet auch niemand von denen darüber dass im gleichen zuge hunderttausende jüdische familien in zig arabischen ländern ihre häuser zurückbekommen müssten,1
deu_a26f3e0f08fa8509201401e64f844365,politik ist auch irgendwo krieg zwischen den parteien und im krieg stirbt die wahrheit bekanntlich als erstes,0
deu_8c82418a0a6c60f056bde1c6d7cb1156,hurra jetzt ist das klima gerettet,0
deu_d397483385c885de5270e3399988cdb6,linksgrün versiffte bald hagelt es bomben ihr wolltet es so,1
deu_904e2f9283f16e1c01e09874f0ef1346,kannst ja mal nach moskau fahren und deine genialen pläne vorschlagen,1
deu_aacca323076fb6cd67204826d800df64,jede person die ernsthaft woke benutzt kann man nicht ernst nehmen lol wie schnell sich die zeiten ändern haben woke nicht gerade noch woke benutzt sonst hätten wir das wort nicht,1
deu_dea3f49e7b22aac551a0b9b94eded906,also pro putin ist links,1
deu_c70e61c426096d9cb22235ad155c753d,gt aber trotzdem halte ich waffen ect für völlig falsch es muß endlich frieden auf den tisch kommen wie willst du ohne waffen rus zum frieden bringen ohne waffen nehmen die die ukr ein dann ist auch frieden,0
deu_fffd25cbb54055c6952335bf9c50b840,die jüdische allgemeine hat das problem des muslimischen antisemitismus mehrfach klar benannt das muss man ihnen zugestehen,0
deu_728c226dc803f18a7fe2b0c3dc6a4ffd,auch das passiert aktuell in gaza genau,0
deu_d582a273f2590ec775e6a02da53173d1,huch unglücklich ausgedrückt muss man ihm verzeihen dem petr er hat ja noch so seine probleme mit der deutschen sprache jahre nachdem wir ihn als flüchtling aufgenommen haben,1
deu_074873542ba5e59619b636382fb906b3,hätte hätte infektionskette sag mal hast du covid verpasst,1
deu_66a13e7dcd6a666237f8e7ae959c5f17,ohje jetzt kommt die woke sprachpolizei,1
deu_8474766a55e9c6ef2d28c9a6aaa237ef,ist putin für dich rechtsextrem,0
deu_8b5bfbd0b3a0ce49c6a19e1ef1f75280,wenn man ehrlich ist was ist die politische veränderung von fff hatte dazu gestern schon mal etwas geschrieben,0
deu_f1461695262428d02cfa0e32613f8bfd,viel weniger migration ein sicherer weg unseren wohlstand zu verlieren,1
deu_407b9528737a8052d950f9971e7ab126,laut dir ist eine minderheit der juden also nicht antisemitisch weil juden ja nicht antisemitisch sein können die mehrheit der juden ist dann aber doch antisemitisch wie soll man gegen solche meisterleistungen der logik noch argumentieren,0
deu_0409269b4bc98c65504e263d572ed5c8,gilt das geklatsche für pflegekräfte während der pandemie,0
deu_5d853dec9ae105f21500705cd9ee3cf7,vor der verfehlten integrationspolitik und der gefahr die vom politischen islam nicht zwangsweise dem islam selbst ausgeht,0
deu_48331d450fc652524d85d54e1a5c051c,aber manche araber mehr als andere israelis aus sicht der terrorverharmloser darum geht es doch,1
deu_1d539254c3c5a59f0f80c1af844dcb05,haha ein faschist der statt in den braunen in den roten farbeimer gefallen ist,1
deu_945f4b0d75d1bbda36cef5c4e2a15eaf,ich will den frieden aber nicht wahren ich will dass mein nachbar respekt erlernt und grenzen akzeptiert das ist mir viel viel wichtiger als der frieden,1
deu_63e83d31709d0c1117d83bd6a8dcb33e,für linksgrün sind die freien wähler und die union doch auf der selben stufe wie afd npd und dritter weg steile these,1
deu_baaf292debc0c8b144e9bbad27164f0e,nö aber alle im ausland lebenden nationalistischen türken sind irgendwie nach definition im ausland lebende türken und um die wird es vermutlich auch in threads gehen wo sich einheimische türken über gurbet i aufregen,1
deu_2c36758d726e8e2b1f0f89114a8f1f66,woke hollywood insert muslim into viking scandinavia,1
deu_f5b15d4f486295979732c9e7ce6c3658,dann müssen wir halt ein paar russische assets verstaatlichen,0
deu_d9e1f7a9634a7f32dbc84b2f73ab66ae,könnte corona sein shit ausgerechnet heute,0
deu_544c1eb20039ef1616312d8ee0c15908,das glaube ich nicht er erläutert nur wie die sogenannte gender ideologie zustande gekommen ist,1
deu_224fc8c6e36ed323c3888ac964b135e5,ideologie mittlerweile ist alles ideologie was einem politisch nicht in den kram passt nur noch pejorativ gebraucht die eigene parteiideologie ist dagegen eine differenzierte meinungshaltung egal wie einfältig sie ist,1
deu_c69222c17ea34105d35f5390adcfb15e,ich dachte alle muslime sind terroristen s,1
deu_be463d28f90c06aacf6edc115092b76b,ja aber die nordkoreaner wurden von russland geholt und nicht der ukraine das die ukraine auch verluste macht ist logisch,0
deu_079609ccfceb3045f2db299e3f7c38fe,andere trinken pferde entwurmer gegen covid,1
deu_17afa377a97ff179262cdd820d3516a7,vatikan und russland,0
deu_ebfd97fcf775e313569df3e679641a1d,ausländer hier es geht solchen leuten nicht um ausländer es geht um ihr eigenes ego es geht um die selbstverwirklichung sonst ist alles im leben gut die ausländer werden dann möglichst von oben herab behandelt schon gönnerhaft,1
deu_e03bb10d9d1ccb12ca6b200910c0881e,freunde des russischen faschismus wie frau zarenknecht sollten mal ganz vorsichtig sein wenns darum geht wer kriegstreiber ist,1
deu_46b3685659ad4b0d6fa0af061c40e4fd,die impfung hat vor ansteckung und verbreitung geschützt nie zu erst mit dem auftreten von mutationen kam die impfung weniger gut zurecht,0
deu_62b5fe7fad261d5a6745d14af2e19a64,das problem ist dass diese wahlstatistiken immer verzerrt sind von den türken die wählen gehen wählen erdogan die integrierten türken haben entweder gar keinen türkischen pass mehr oder gehen nicht wählen die nationalistischen religiösen spinner lassen sich motivieren,1
deu_e08b9a0304f494fa7d2f573f26f3e943,archiv frankreich gynäkologe weigert sich transfrau zu untersuchen,1
deu_5cccd4278f7ea52f9f3d9d3a83332b37,das ausländer sich in deutschland integrieren,0
deu_d503c36f2c308ab00deefd9a7950849a,russland besetzt moldawien,0
deu_06f6d73f193b9dd079dcde68e886cf46,spätestens nach den ereignissen vom samstag greift godwin s law leider nicht mehr hitler wollte die juden ausrotten hamas will die juden ausrotten und da solle man nicht vergleichen,1
deu_e1c991b613cfbd9f8b58591e03032c7b,steuerzahler und juden,1
deu_efa6273274664d33c69de2d381196e8c,gerade das ist fürs immunsystem wichtig,0
deu_17eb2ab65d63e181225858cc9c746a04,eine hamas rakete,1
deu_27d0cfba29e0f1a5c51f6563fc89f760,letztes bild der au prediction ist interessant allerdings nicht verwunderlich wenn die woke queer feministische leitkultur merkt dass sie sich selbst abschafft ist es zu spät,1
deu_2058f8b4a3f82b5596c66cc80ee8cd0c,ich war bei einer örtlichen hilfsorganisation in lviv bin nachher nach kiew,0
deu_2674a41026ef85140789647c71d0a35f,des terroregimes der hamas die tatsächlich einen genozid durchführen die hamas ist wahrlich keine organisation die irgendeine unterstützung verdient aber wo führen die einen genozid durch,1
deu_61ccdb7cd2f40832bf8be3c26dbffc41,klingt arg nach russische propaganda und,1
deu_8cf41a1b990b6e2bd8c7e254a7b276b3,warum ist ihre partei pro israel,0
deu_fac5040dd02d50ea751af2bababc3891,wenigstens können die deutschen in der pandemie folge etwas gras rauchen,0
deu_b5daa50df304de298850c2e64e0d3b10,gesellschaftsspaltung woke neoliberal,1
deu_2b81cc425e005d5944db620cffae6767,die ukraine hat verloren,1
deu_0328d01e5d370c041827a8e480e729a9,ruhe in frieden,0
deu_75b47c137270dee5aa5b77a24b065f78,regierungskritik alle juden und regierungskritische juden antisemitisch gegen sich selbst habe verstanden,1
deu_d802407f2b0bd91ecde7d2902f4ba82e,religionen sind märchen satanismus gehört da dazu wie auch das christentum oder der islam,1
deu_f6099ec3882d167aac7e27326c675fe3,kann es sein dass du verpasst hast wie beschissen die ukrainische offensive wirklich läuft,0
deu_11c2d17f7d04180f85158c919e1bfb5b,ganz klar eine ukraine koalition,0
deu_493d1e22b65a66f7c5fc6a03b006b4cf,ein gefährliches virus das sich weltweit ausbreitet und vor allem ältere risikogruppen tötet wäre mal nicht schlecht sarkastisches s,1
deu_3c292f601403e2cb6f32baa99727f61c,unrealistische wahlkampf versprechen sind aber keine erfindung von trump oder der cdu,0
deu_1977a611387162a9c66b6d09d5e1725a,jan josef querdenker oder sowas war da doch,1
deu_e3608af872194ccd721ae423ec966497,go woke go get broke n into your,1
deu_cf2679a63f1b2889b63ba715abea2da1,und dann hätte das trotzdem ein team eigenmächtig durchgezogen und nicht der ukrainische staat,0
deu_65f5225b10f07cc3766005fa65ee81ec,bin mitte und ja ist vermutlich echt long covid,0
deu_ae0bc98d3a1034ad4b94883c30992e32,wenn gender nur ein konstrukt ist wieso mit testosteron anfangen,1
deu_121beaa12676ed70eefd620734e70734,vermutlich nicht aber ideologie mit sachverstand dürfte besser sein als reine ahnungslose ideologie,1
deu_a63a047f36703814f37345e83687a647,nein op begründet sein verhalten mit einer ideologie deren kern es schon immer war über andere zu urteilen es geht nicht um eine kontaktschuld es geht um die ideologie an sich,0
deu_51e6a19aae70e13aaf204c9b7acc9199,ah da kam also die dienstanweisung aus moskau,1
deu_d891f25fec4069c02a2023e2a457fc64,weil das geil für den ag ist und geil für den an win win nur die letzte generation findet s doof,0
deu_b1cf7dcd364ea0324649416095df95c6,das klima ist größenordnungen komplexer als aktienkurse wenn klima so gut modelliert und vorhergesagt werden kann warum sind dann die wissenschaftler nicht längst millionäre an der börse,1
deu_5b8bcb42123f86fff0c40de6c9c5fb99,tut mir leid möge sie in frieden ruhen,0
deu_109dec9dd69e81b7690e37b949ae5e13,jetzt mit windows defender zumindest in quarantäne wie lösche ich den virus jetzt,0
deu_ed13e294fa0b663da84fee2513702fca,wir müssen das klima zerstören um das klima beschützen zu können,1
deu_4ba688ed83c6c96a55ec94611cfa2c78,meinst du aus der woke culture aussteigen,0
deu_2545360decdf6903d191b98980745b66,die definition von kriegsgebiet ist natürlich etwas schwammig ich sag s mal so als kiew in meinen augen kriegsgebiet war war ich in deutschland und sollte kiew nach meiner definition wieder kriegsgebiet werden werde ich aller voraussicht nach abhauen,1
deu_64d22e8ac162227770a34875c65a1c7d,wenn alle stricke reißen moskau inkasso aka unangenehme typen vorbeischicken,1
deu_61a753cef39b4bdc916cb86cd18fb38c,du kennst den unterschied zwischen einem flüchtling also einem menschen mit echtem asylgrund und einem einwanderer,0
deu_137527475d4ebae03d1b80c4707d9c8e,sieht russland leider ander,0
deu_e6373e7e840659f754f919d83313196c,ich empfehle die route durch kiew die visa erteilung sollte auch in kiew stattfinden,0
deu_e5e04acf0ae0de8d448ba3f9be569888,ich hätte mich vor dem oktober und die darauf folgenden demos in deutschland noch über so einen kommentar aufgeregt aber die letzten wochen haben meine augen geöffnet und die jüdische community hat mein volles mitgefühl,0
deu_b2327c9389f33f648a797d9d6f4239ab,wäre die letzte generation mal lieber ein naziclub geworden dann hätten die das jetzt nicht an der backe,1
deu_efb46bb972883b9fccea13e6a9be8258,sind doch die letzte generation,0
deu_d7836d16b7202d9ed580c14c11267443,doch doch muslime gehen immer,1
deu_a6e458816f72040d5169c15bfacdcbac,die hamas ist keine regierungspartei in gaza was denn sonst die hamas übte bis zum israelischen einmarsch nach dem oktober de facto die staatsgewalt aus,0
deu_def1d174cde692189d74b0de7b1fc44b,quatsch hamas sind doch freunde die wollten nur etwas nachverhandeln,1
deu_4be2624856333536ca22e9f2cb12df51,steuerzahler bzw die bevölkerung in d und auch eu wünscht sich außerdem mehr tierwohl und umweltschutz,0
deu_ca9d15f45e43e92d4ca777c391d85a55,seit wann sind juden eine rasse,1
deu_e55cc3e8c2ca0331aac825fe8e281c4d,wann fährt die politik mal einem harten kurs gegen diese menschenhasser und kriegstreiber währenddessen werden weiter ins land gelassen und fröhlich alahu akbar gerufen und scharia für deutschland ich kotze und das lassen wir uns in unserem land gefallen was sind das nur für zeiten,1
deu_73922269604c8ac488e19a807c1269f4,der ukraine vergleich ist passen der ukraine vergleich ist absolut unpassend in der ukraine versteckt sich keine bande von terroristen hinter zivilisten und geiseln und im gegensatz zur hamas versucht die ukraine b ihre zivilisten zu schützen,0
deu_ede9c2b81a8916022903bfe2be2eadfb,vermutlich einmal gelaber über an vs mit covid bzw wars nicht covid sondern die böse böse impfung,1
deu_cfae659122328c054b86d1e888ab23b3,also so ähnlich wie die co pauschale,0
deu_a336fb95e682de60e025b143a90363d1,russland hat schon einen teil der ukraine besetzt und überhaupt was juckt mich die ukraine eigentlich,1
deu_8362f929c3ce2c50e3ab4f71b054bcf3,die durch covid geschwächten meinst du ja ziemlich sicher,0
deu_9274d9cf8b07ee0b7febadf355cf6644,wie sehen das die fff bewegungen der anderen länder eigentlich,0
deu_1536ef657a515b8462ad5245b6fb7507,da wird jeder gebannt wer auch nur ansatzweise kritik an fff und den klebern äußert,1
deu_60fbca1e49bcbfb7e639b4ed87840a76,duh es heißt wahl kampf veranstaltung was erwartet sie da lul okay aber jetzt im ernst hoffe ihr geht s bald besser,0
deu_004b3b0315a4f56097679a322b39a44f,ich bin eigentlich ein freund des konservativen aber die verbeißen sich völlig am thema gendern queer und sind korrupt wie scheiße,1
deu_9516527e6499a7b515927c012c32f5bc,würdest du sagen das die meisten muslime sehr extrem sind und die afd recht hat oder sind die meisten muslime entspannte moderne menschen,0
deu_8c5dd7393e4ae8db634c7903623cedc0,es wurde eine transfrau von der co chefin der partei die linke geschlagen und das ist kein skandal,1
deu_7083ca5c6e5a797736b0357639883b8b,vielleicht auch long covid oder sowas,0
deu_a06e8abc6b8cb3974960166beaa60429,ich denke dass das nicht nötig ist in dem verlinkten artikel steht dass seit dem krieg gegen russland in der ukraine zu silvester raketen feuerwerk verboten sind das bedeutet dass es vorher wohl normal war an silvester feuerwerk zu zünden also dürften deine nachbarn wohl damit rechnen dass an silvester geballert wird artikel,0
deu_0e142562d036c090cdf29a4db4e7aa50,er will hat wirklich mit den moskau antidemokraten regieren,0
deu_53bcc0f577421b282d08a38495ede8e9,cool hat die hamas mittlerweile alle geiseln freigelassen,0
deu_42d6137c32ac0814f16d8b5eab356128,naja sie sagt doch dass es in ihrem land nicht möglich ist warum kann ein araber oder afghane nicht auch flüssig deutsch sprechen,1
deu_c0bd18ac01af1a0f7eae7757a1d6cf36,putin du hs wann frieden,1
deu_c88e24c2928cba80a9b19315643aa970,bullshit nicht jeder araber ist strafrechtsanwalt nur jordanier,1
deu_f185db48db07897732bf315bc6922167,nicht halal koscher geschlachtet judentum und islam bleiben hungrig,1
deu_0f584e2d56de4be195277c5617c4f94a,ich stell mir wagenknechts email postfach echt spannend vor dringlich heute bitte gegen ukrainische flüchtlinge hetzen dein putin,1
deu_f6f343f8fa168067500b6c1d75071fea,danke für die demonstration der grenzenlosen arroganz und hirnloser überheblichkeit von reddit antitheisten genau deswegen mag euch niemand nicht mal normale atheisten,1
deu_8f781ff8fdf6a0856b13759d1d6e76e7,er war in letzter zeit wohl bei mehreren reden ziemlich besoffen dabei hat er den krieg in der ukraine sogar als krieg bezeichnet und wurde daraufhin angezeigt weil es in russland illegal ist den krieg als krieg zu bezeichnen,0
deu_86ded985baeb64e16b636ff47de858c9,diejenigen kein asyl wollen und das vertreten müssen das aber auch ehrlich sagen die nächste frage wäre dann aber wie man asyl definiert und was passiert wenn es nicht gewährt und das sind momentan sehr politisch relevante diskussionen die aktiv tot geschwiegen wurden,0
deu_74cad3060eebec63bfaf6cd84b21a5da,one more reason to hate hamas,0
deu_e257fa0b458835e931fb0a2825b6b3ab,kann man das so allgemein fassen gibt doch bestimmt atomwaffen die besser funktioneren wenn die näher dran sind oder nicht und belarus ist recht nahe an kiew dran also wäre doch die message als einschüchterung schon erwähnenswert,0
deu_10d0084f765e6478e4b4fb864dc23d98,sind sie der geisel gangster,0
deu_39af2306d5b61c6b5f779788e06f5f37,pass wegwerfen und als flüchtling anmelden,1
deu_d8f10cf1dcd06024daee74ab58cf9079,ist doch gut wenn die araber den logistikpartner der bundeswehr kaufen während wir krise mit russland haben kann ganz bestimmt nicht schiefgehen,1
deu_dbf4db2e058ff62377d391db48a88a2f,ehrliche frage wo ist es denn tatsächlich sicher für jüdische menschen als außenstehender würde ich zb israel auch vor dem nicht als sicher bezeichnen,1
deu_94f4839a8f9739d0abbc9dabbea63f2d,unglaublich jetzt ist sogar russland woke s,1
deu_1a6422ad66b5d844b964c39c8aef7a29,fff haben die kids selber organisiert weil sie es gut fanden hier nutzen die eltern ihre kinder für protest,1
deu_83c09ea039cd95b7aa77b15669b919dc,was für ein querdenker,0
deu_636deeeda9577cbdb5169b30f26e6b08,hab zuerst hentai virus gelesen,0
deu_446deb28e9c589ac09594156be74020b,wenn man als jähriger nicht wusste dass solche schriften falsch sind muss man ziemlich retardiert sein sorry und seitwann ist es linksgrün wenn man findet dass menschenverachtende und genozide aussagen schlecht sind das sollte jeder mensch scheiße finden auser halt faschisten und nazis bist du ein faschist,1
deu_5a51863238803d89f87a6aaeaaea0ef6,benehmen sie sich,0
deu_1cede8441b0099fbcde26f586fe11087,ein zertifizierter faschist ruft nach mehr repression welch überraschung,1
deu_3cfb23392e478555655ec4c8204f8411,die araber hatten ihre chancen für einen eigenen staat aber man hat einfach lieber krieg gegen israel geführt und beschwert sich nun das man verloren,1
deu_b7e7c0c3d27ff7ab934e5000df5ad0da,das woke im titel hat da ja garnix zu suchen oder ist man jetzt woke wenn man x den wahl o mat durchklickt und bestimmte antworten kriegt,0
deu_ad664869953ce8b056d0517b207def91,mir liegen muslime nicht so arg am herzen das ich in ein gulag gehen würde,1
deu_6bfb72a14c2ab61cc63535f566269ca0,die ukraine bekommt nachschub s,0
deu_3870a75b33bdd6ccf30dff3fff1df396,krieg macht mich richtig geil,0
deu_9cf94c2d554d6efc1e247810f21afd46,mit corona auf dem sofa,0
deu_8df83f05a6fdcbb830f24301443b95db,das pinseln bringt nix immunsystem aufbauen und von innen mit tabletten bekämpfen,0
deu_1facbdc952010a76e4b29054ee464417,rheinmetall profitiert von krieg,0
deu_708b023f8b8fb95943b9965d76c8c6eb,keine ahnung ob die alle gläubige muslime sind spielt für meine bewertung aber auch keine rolle,0
deu_e4431b862c5e548f518a29e03b2e2c96,warum sind woke oftmals so derbe untermenschen,1
deu_3b6f2bf2db80efb613d952cd4d87a3e7,jeder dritte österreicher ist also ein faschist wenn man durch wien läuft sieht man quasi hunderte jeden tag oder,1
deu_61479c131ace12b6f12cbb8607330bdd,kann kiew polen wegen eu recht überhaupt verklagen wenn die ukraine nicht der eu angehört das sollte die eu komission tun,0
deu_f7d240cf6ad3714f87beb1eeab57eada,undemokratisch sind alle die nicht linksgrün wählen ist klar vermutlich bin aufm besten wege hier gebannt zu werden beste demokratie aller zeiten überhaupt nicht reformbedürftig,1
deu_e76023c4745c1c47592389aa84c454ec,dürfte sich jemand wie op denn deiner ansicht nach als queer betiteln,1
deu_25a4f8a8e31d4635c9e86fe8d8d0a2ea,zum glück schädigt covid nachhaltig das immunsystem,1
deu_be30bf36eb656424206d95d738ce9ec1,also ich nehme auch gerne faschist,0
deu_7915dd2e1f0c5509d40912979f1071c1,haben als russische familie klamotten an sie gespendet,0
