id,text,polarization
deu_b575620d4f1294000425e2152f70beab,stimmt absolut extremismus in israel is ein problem ebenso kann ich auch den fundamentalismus kritisieren der israel ständig mit raketen bedroht das ist das primäre problem heute und israel ist berechtigt sich hier militärisch mit allen mitteln zur wehr zu setzen,0
deu_1c30379a9965395e94224511d07f8053,russische waffen funktionieren am besten gegen zivile ziele,1
deu_c5895f7821acf3710ab600b863e117bc,es könnte auch daran liegen das ein faschist eine führende position in der partei bekleidet und die partei das anscheinend nicht problematisch findet,0
deu_89d1910ac16ae4480863061c31a932e5,schwul sein bedeutet nicht dass man sich der bei der lgbt bewegung wohl fühlt queer ist ein von dieser bewegung genutzter begriff weswegen sie dem halt nicht zustimmt,0
deu_67dc946a97ecc3cb9fc8667b0c9ab8ec,zuletzt sieht man auch die muslime werden rauer untereinander,1
deu_dfd0aaadc5365c87d7355a44e262e636,also juden hetzen gegen juden und das is eben nicht der fall es wurden pauschal verbote ausgesprochen explizit moderate demos wurden zwanghaft aufgelöst,0
deu_a6782e77bf0b4628f6474e73ef173db3,findest du auch putin attraktiv,0
deu_2e749db3bc322ae0762ef7ea3df31225,ja söder ist allgemein ein arsch aber in diesem einen fall nicht,0
deu_7fb53efec7590a209f81c89d6485cc78,russland kritisieren israel aber nicht ja der unterschied ist das israel angegriffen wurde russland aber nicht was israel macht ist reagieren und legitime selbstverteidigung,1
deu_0d02c1c7ae087b3eb951fc09075d2601,lg existiert weil sich nichts geändert hat es ist eine eskalation von fff weil fff nichts gebracht hat und die zukunft unseres planeten weiterhin für unseren komfort jetzt verkauft wird und es wird noch weiter eskalieren logischerweise wir halten den kommenden generationen eine zeitbombe vor die brust und beschweren uns wenn denen das nicht gefällt und sie versuchen etwas dagegen zu tun,0
deu_99adef527bc056ee99363f27439686b2,ich denke du traust russland da zuviel zu nur weil die afd gerne sehen würde dass deutschland wie russland wird heißt das noch lange nicht dass russland die afd steuert das ist eher eine gemeinsame affinität die afd sagt du bist mein vorbild und russland sagt du bist nützlich,0
deu_e6712daed73f9b6cc7d184827fa8df62,ralph fiennes als putin wann,0
deu_2e932f20e0a51b3311936492b006171d,ukraine soll sich nach deren auffassung noch immer nicht verteidigen dürfen das ist gelogen stellt ihr das selbstverteidigungsrecht der ukraine in frage nein die ukraine hat das recht sich selbst zu verteidigen die un vollversammlung hat die militärische aggression russlands gegen die ukraine ab februar als verstoß gegen das gewaltverbot der un charta missbilligt und damit das selbstverteidigungsrecht der ukraine gem art un charta bestätigt,0
deu_8ecc524379d900652a682731ee01620c,als man das alles damals anzweifelte war man aber querdenker was denn nun,1
deu_d90de7688013fe39a61306980d36b535,linksgrün auf reddit es ist vollkommen unmöglich heute noch ein haus zu kaufen wenn man nicht gerade im lotto gewinnt oder reich erbt auch linksgrün auf reddit die dummen nazibauern bekommen fürs nixtun millionen in den hintern geschoben und machen es sich mit dem dritten mercedes schön duschgedanke startet doch einfach in eure selbständigkeit als bauer wenn das alles so easy ist und man unweigerlich reich wird wo ist das problem,1
deu_956430b2be9c80dc7c7ab8e9cbd2757e,die letzte generation hat sich aus dem kampf auch verabschiedet konstruktives kommt da schon ne weile nicht mehr,0
deu_236d0f523f1d6cf97de3e725d7b88fa4,der impfkalender vom rki du solltest dringend die tetanus impfung auffrischen,1
deu_1b3bc952acb424976d80269f5d7f9a0e,oder schreiben sie das jetzt wegen dem thema klopapier während der pandemie,0
deu_6fc857ed62caec48b6bfc3ef29fad31d,vergiss nicht bleibtreu mit dem kannst du sogar araber türkenrollen besetzen und sparst dir diese schauspieler s,1
deu_9ac8ddedc786ef55e93150493c1884c7,das ist keine rechtlich angemeldete demonstration damit ist deine ganze aussage schon müll,1
deu_fa3ac7c50658da8a68a818d7795e6c22,immer dieser strohmann von unbegrenzter migration jesses,0
deu_ef74969900f78d934a1827ca96126191,darf jeder jetzt sein persönliches asyl ausrufen,1
deu_dc7bffb1e27b4644492d08bdb01c9bcb,kalter krieg wäre an diesem punkt ein fortschritt weil rückschritt stop gerne den heißen krieg,0
deu_b678d14a318e9ec66720be4f52a49a3d,ich sag ja nur dass es unter homosexuellen nicht selbstverständlich sein muss sich als queer zu bezeichnen,0
deu_6fa29a7a847161f809f21be2c56027c9,also beim thema russland ist die linke geschlossen auf russland linie da wird sich ändern,0
deu_020d7ac2161541caa57f67e567953b32,das könnte die gesamtfassung sein,0
deu_0465160ac4e29b5786f7e15619c5549a,muslime islamisten bitteschön,1
deu_e2d56ad2f4d67ed07fc902d6333471f8,vllt is ja nicht nur das immunsystem supprimiert,0
deu_ba98687e77f3f4501eb9a4b849709399,was schweben die denn für grenzen vor meine grenze ist ja dass nicht unschuldige zivilisten umgebracht werden aber scheinbar ist das ja nur unmoralisch wenn man araber ist,1
deu_4195884a835aba00b3f7274e9fdb7d7a,an wen geht die co abgabe,0
deu_9bf99c9752e29ee10b09fbb0f8751d25,pro kopf co ausstoß in kenia ist mit dem wohlstand die letzten jahre gestiegen pro kopf co ausstoß in uruguay ist mit dem wohlstand die letzte jahre gestiegen pro kopf co ausstoß in namibia ist ca gleich geblieben dort die wirtschaft und der wohlstand gesunken nochmals du kannst auch mit chatgpt die realität nicht ändern mit wohlstand wachstum kommt das co einzige bekannte technik zur reduktion bei wachsendem wohlstand ist auslagern co produzierender prozesse in andere länder und so bilanzielle co reduktion im eigenen land alles andere ist nicht nachweisbar und nicht existent sondern das sind alles theoretische überlegungen,0
deu_b22f4201a58322de941dcd8a02685db3,naja da gibts schon einen unterschied zwischen islam und politischem islam nein gibt es nicht der islam ist inhärent politisch und es gibt keine trennung zwischen spirituellen und gesellschaftlichen fragen,1
deu_74abad5af533eb20e79612e903076c03,russische manpads haben ein problem sie sind russisch,1
deu_b48457367ee6097fde417b7d50c270a6,blöde frage bist du für kontrollierte migration und rechts extrem afd bist du für kontrollierte migration und nur ein bißchen rechtspopulistisch veranlagt union cdu csu hast du verstanden dass es keine unkontrollierte migration gibt und dass die migration nicht das problem ist sondern die lösung sein kann irgendeine andere partei die voll und ganz das konzept der freiheitlich demokratischen grundordnung vertritt ist doch gar nicht so schwer,0
deu_2b9b2462c426f48be2b2d4baab99d575,oh gott du hast den zorn von tausenden türken auf dich gelenkt s,0
deu_8f6dadd1f7670c9fbbb4fc56a482e826,hier übrigens die quelle die araber haben sich dazu entschieden israel immer und immer wieder anzugreifen neins,1
deu_5db1d90c6008068d637f0264d8868c20,aber da waren doch auch keine araber am randalieren oder,1
deu_587282139ec68cc636ef3a3a6da1e962,stimmt wichtiger ist in diesem falle die impfung gegen metallstäbe,1
deu_0e105d1070d402cb284a223ea6587f42,die schrecklichen konfessionen des russischen kriegskriminalitäts und die kommunikation durch ukrainische sicherheitsdienste die schrecklichen konfessionen des russischen kriegskriminalitäts und die kommunikation durch ukrainische sicherheitsdienste,0
deu_710b41e45630bb269264893ef9b832ac,solange eine pro nato regierung in kiew sitzt sitzen dort auch noch nazis und das russische staatsfernsehen wird die erfolgreiche entnazifizierung nicht verkünden,1
deu_b75d817459be5184e0185cb1b64ebe8c,na da hast du aber noch gender und lgbtq vergessen,1
deu_fd974993d13227657a2d4d73ffd20c30,op das mit der impfung hast du falsch verstanden die impfung konnte herzprobleme auslösen ja aber corona tut das auch eine schwere erkrankung mittels einer impfung zu verhindern schützt dein herz mehr als es dadurch gefährdet wird,0
deu_b872aee6924ebd6ad044ab2ce0e16ce2,afd oder andere politiker mit extremen ansichten linksgrün,1
deu_49135d52b01cdbcf631a7b76cad5ef5e,die schwarzmeerflotte feuert vom hafen aus viele marschflugkörper vom typ kalibr auf ukrainische städte das sollte schnellstmöglich gestoppt werden,0
deu_3e491e78838249edce7060303a24db04,also sollen die juden in israel sterben gute alternative s,0
deu_bebe5deb418db8486d00cc6ea6599c9f,eine ausbildung zum soldaten ist etwas völlig anderes als ein realer krieg auf das was sie im krieg sehen kann sie nichts vorbereiten sie können ja gerne mal soldaten fragen die im krieg waren,0
deu_40ae1a2bd7d59ac08b6136b5c77e6f5d,was laberst du aufgrund des extrem schnellen bevölkerungswachstums in größtenteils muslimischen ländern wird der anteil der muslime an der weltbevölkerung bis um ca prozentpunkte steigen während der anteil der konfessionslosen an der weltbevölkerung sinkt,1
deu_3786665fe3a2ca54d62b5a7c10f83508,putin betreibt schadensbegrenzung nachdem er es nicht mehr leugnen konnte und schiebt den grund auf ukrainische ftfy,0
deu_73df98f85901c0f92981da4efe9727ec,ehemals sehr eng befreundet gewesen und jahrelang zusammen kampfsport gemacht mal pro woche der großteil zog weg nach dem studium trotzdem regelmäßig kontakt gehabt mit corona hat sich das stark polarisiert und die drei jungs mit denen ich am engsten war sind komplett in die querdenker und verschwörungsszene abgedriftet und hat sich teils auch vor der pandemie afd nah geäußert einer ist soweit ich weiß noch in deutschland plant aber nach osteuropa zu ziehen die zwei anderen sind brüder und vor der corona diktatur geflohen der eine nach ungarn und der andere in den iran der teil mit dem ich noch kontakt hab ist jetzt überspitzt gesagt linksgrün und setzt sich aktiv und kritisch mit rechtspipulismus und fake news auseinander,0
deu_bac3accd5b450834785c0967f77fa421,eine legende ruhe in frieden,0
deu_01c65390dead6b4ed1062130def5b10b,scholz laviert schon von anfang an im halbzögerlichen raum herum und versucht es so beiden seiten recht machen mittlerweile ist er allerdings für die einen kriegstreiber und für die anderen ein angsthase,0
deu_71dc809a67551eaf6ae7958a1f16b398,ich nehme die begriffe aus dem englischen dort wird zwischen gender und sex unterschieden sex ist rein biologisch also weiblich männlich oder intersex gender ist gesellschaftlich biologisch bin ich ein mann gesellschaftlich frau zurzeit setzt der größte teil sex und gender gleich ansich nat es aber nichts miteinander zu tun,0
deu_202157ebaa8a922c46dbdf25955d6b8f,also wieder mal ein sturm im wasserglas fff hat einfach nicht genug traktoren,1
deu_6e62610a5b189635c3b1fc94b26a30cd,tja das nennt man krieg ich weiß ganz große überraschung russland hätte auch einfach nicht einen krieg starten können,0
deu_311bb434ddfc9c2b03ce6eab64bdadad,der in de lebenden türken haben ihn laut ntv gewählt nicht richtig es sind der wahlberechtigten sprich von mio wahlberechtigten wählten etwa der hier lebenden türken überhaupt irgendwen und von den k etwa erdowahn dann sind das in summe max k türken die erdowahn wählten ja das kann man immer noch blöd finden aber der irgendwas mio hier lebenden türken wählten erdowahn ist einfach eine falsche aussage anm das ganze nur grob überschlagen mit einem tage alten artikel der bz zur wahlbeteiligung der mio wahlberechtigten türken die in d lebten,0
deu_ad2207b34e0b4ab5425ab162f4044d64,israel wirs nicht durch die jüdische religion geführt und dann wundert ihr euch wenn man antizionismus mit antisemitismus gleichsetzt,1
deu_03402dd2bf2ebd691ac534151afbbd34,achte stets auf umweltschutz sonst gehn wir kaputt von schmutz und die mutter erde gibt es bald nicht mehr,1
deu_606427cf8fc53f8d57b45120a4434067,dass der typ der politischen gegnern mit haft oder gar hinrichtungen droht und das militär gegen die eigene bevölkerung einsetzen möchte andere als kriegstreiber bezeichnet ist eine erstaunliche kognitive dissonanz die trumpisten sind eine größere sekte als scientology,1
deu_c71039346eab5412a3d59ef2fa366946,dass wir es uns nicht leisten können die ukraine nicht mehr zu unterstützen die ukraine weiß das auch,0
deu_a64433d07c710274680587a3cf5ef1dc,das sofortprogramm von fff sinnvolle vorschläge keine umsetzbare vorschläge keine radikaler populismus,0
deu_2bd1299070ad6aff5e19b12a6738a20f,als nächstes klebt sich noch die letzte generation dazu,1
deu_93225cce79a44f71aee9ffe2a87c3dd4,nur weil man dick ist hat man kein schlechtes immunsystem,0
deu_4fc7bac3d8de09ca9811910f0af65bb0,nein war ja geld für die hamas und ich halte von der hamas nichts die hamas war die regierung im gazastreifen sehr viele hilfsgelder sind am ende an sie geflossen und halt dass er die hamas stärker werden lassen hat was wäre die alternative gewesen die hamas stürzen oder sie isolieren und damit im endeffekt gaza inklusive die zivilbevölkerung aushungern,1
deu_117cbaa7cd4f208e56bf5733d984fe50,wer aus protest eine nazipartei waehlt ist fuer mich ein nazi,1
deu_b5613c293574114bd03256282327f182,die antwort die der nutzer nicht geben möchte ist null keinen einzigen juden dies schließt natürlich das jüdische viertel jerusalems und die ersten rückkehrer nach hebron die von dort erst flüchteten mit ein ja hilft meiner narrative überhaupt nicht,1
deu_e335ab61b2ecebd26cd2bd6bdf00b659,begriffe verlieren manchmal ihre bedeutung oder bekommen eine andere siehe querdenker,0
deu_bd573c610eba1cfe88d5f2449db35d0d,ja cool und ich melde leute die schreiben ist krank der typ der wird immer ein mann bleiben bei einem artikel über eine transfrau aber das ist voll fein und wird nicht gebannt lächerlich,0
deu_4e629e7f36c33b31da41b5c0a32f9a80,unter russischer besatzung kann es keinen frieden in der ukraine geben es gäbe dann keine ukraine mehr die jetztige ukraine wäre russland einverleibt und man würde in einer diktatur leben,0
deu_bab4edca384948090bbf2aaa17d38265,unter antisemitismus leiden vor allem muslime unsere bundesheulboje,1
deu_6fd1c5db94b1314454b6df2153ab5871,konstrukt klima jetzt stellen die schwurbler nicht mal mehr den klimawandel suchen sogar das klima selbst in frage herr lass hirn regnen,1
deu_3e79a188bb6efca417f17e083cba0ae4,zionismus jüdische bewegung die das ziel hat einen selbstständigen nationalstaat für juden in palästina zu schaffen ich will das israel existiert also ja,1
deu_e4b3448f48dc4dd53559e3b42683ec82,krieg könnte das ändern will ich natürlich nicht aber soldaten die aus dem krieg zurückkehren zeugen viele kinder,1
deu_f771ae716ca5809ebb3395f9a46f5f29,ja aber die woke regierung will das so,1
deu_11f0e9b2b75084b40cc7bd71bcb4b4c7,wer gegen die diplomatie ist ist für den krieg wer glaubt dass krieg frieden bedeutet ist in die falle getappt,0
deu_dbb6edaed6437c6a72b763e3a0fad835,als ob abneigung gegenüber dem islam nicht vollkommen gerechtfertigt wäre,1
deu_f87807936c28b89612d132f01f3db6ca,ein anderer russischer machthaber hätte kiew schon längst dem erdboden gleichgemacht,1
deu_723e01c88c7aa237bbba94ba64ab01bf,bei fff war es ja auch schon immer komisch die haben sich damals beschwert dass der verfassungsschutz die orgas rund um fff beobachtet war damals keinem wichtig nur der aufschrei war groß warum kinder irgendwie beobachtet werden aber warum war immer egal,0
deu_656edd69c925cbcd4db45281fde38032,hat deine mama dem hans georg maaßen wohl protestaufrufe von fff zugespielt,0
deu_8d04e71c6259d8695755f0ed084fc022,aus welcher quelle geht denn hervor dass die finanziers juden sind,1
deu_f2589427336ebb7510fb9e01024ee565,noch besser fürs klima keine menschen,1
deu_63d618296c861bd9f6f59e607e511482,wie kommst du dazu zu sagen du kritisierst den islam aber keine muslime,0
deu_b8531c8d7ce4bfd268391dbc6b2e391e,war bestimmt mal wieder dieser jüdische spacelaser,1
deu_17ed1f45d7bea6419eebd0b4c4eaa801,klima ventilator oder freibad,0
deu_95e641303629586d3dc9a3694d858aa0,was sagt das klima dazu,0
deu_c6041e6e4d1d9ead8315dcac07b8edb6,das flugzeug des präsidenten könnte entführt und gezielt über dem gebiet abstürzen gelassen werden er könnte dann vom selbsterklärten herrscher der region gefangen genommen und als geisel festgehalten werden und die regierung könnte sich gezwungen sehen einen sträfling und ehemaligen elitesoldaten darauf anzusetzen den präsidenten zu,0
deu_b7723242e6ab9eb2dd0870411432b5b5,warum lieben sie russische schwänze so stark dann,1
deu_0d74dac64cda778ee25d55ebf978a0dc,die obsession der nzz schreiberlinge mit dem woke begriff grenzt wirklich langsam an geisteskrankheit,1
deu_fd42201aa6603f0481d28d9c29b77641,typisch türken halt,1
deu_3eacb4e125bddb1d8e7c75ac3aea8809,ausländerfeindlicher ausländer hier ama,1
deu_9e68ae196db30aad424b9e77c888af30,macht israel schon ewig so interessiert dich aber bestimmt nicht wirklich oder,0
deu_fc5d9eea3237e0d3d5e7e9a5b1b5dcab,naja irgendwie muss man ja umweltschutz in die politik einbauen,0
deu_8a8f65ffd3af7d2a716de84854938b19,sag mir dass die russen dich bezahlen ohne mir zu sagen dass die russen dich bezahlen faschist,1
deu_da6638f25f232537c33575ef7aae5afc,wahlkampf für biden,0
deu_e89b0cbd093a04a07396327c4e2b306e,stimmt es wirklich so wie viele hier schreiben dass sich das immunsystem an die belastung gewöhnt soweit ich weiß ist es so dass je häufiger man krank ist desto schneller wird das immunsystem im alter,0
deu_680bb2262a6ce165b5fb71bcf6e4f942,hamas walla lass alle ungläubigen töten ungläubige wehren sich hamas wir brauchen sofort einen waffenstillstand das ist ein genozid,1
deu_ad680fcc4416293ce47bd994a1c3726a,wie war das nochmal mit umweltschutz ist proaktiv und so lol,1
deu_4629080a263497d9270ea5b000c17f3e,mami können wir den irak krieg haben wir haben den irak krieg zu hause irak krieg zu hause,1
deu_b12345a7de1222e6f49151bc590afbe4,long covid ist auch eine längere angelegenheit,0
deu_3304177aed91d3d5b21d89a7e7310038,schonmal an long covid gedacht,0
deu_57d2974daaf9d82eb178cb2144206b15,die unterstützen auch nicht russland sondern russland unterstützt die mit geld,1
deu_8044aba201275be9364952509944df9e,umweltschutz ist heimatschutz solche parolen schreiben sich ja geradezu von selbst,0
deu_9f21dbcd2a25cc452fb892c181c64581,linke wahrscheinlich irgendwas mit gender studiert,1
deu_08d69a77bf3ea2ebdc5e93677ccbe440,joah krieg ist geil krieg ist nice mag auch krieg ahahahahaaaa junge was soll man darauf antworten,0
deu_8f029b064eba5cb239afeb761c9dda8c,wenn man sich nicht gleich dem gender mainstream unterordnet wird man direkt als nazi beschimpft,1
deu_e0bd651baeceaf481c39d644df86765a,einfach das flugzeug hacken und die terroristen aus der steuerung kicken duh s zur sicherheit,0
deu_1eefe4c7379929f28c999ff1dd681c7b,bin grundsätzlich dafür aber damit macht sich die duh jetzt sehr unbeliebt so etwas sollte im sommer als gesetzesvorschlag bundesweit eingeführt werden mit lokalen ausnahmegenehmigungen rhein in flammen jetzt das aufzutischen sieht eher nach provokation aus,0
deu_485b1c61314210e2dd9b292103881bbb,tja leute die russen sind vielleicht gar nicht euere freunde wer hätte das ahnen,1
deu_02f4820f8cd94c2465bd66453f690bfb,die befindet sich auf einem kreuzzug gegen alles was in der neurechten sprache linksgrün versifft bezeichnet wird im grunde versucht sie das gleiche was die afd möchte die uhren zurück drehen zu einer zeit wo es gastarbeiter gab und homosexualität unter zuchthaus gestellt wurde,1
deu_ddeb3f9b70c8107c50ba5a969bb34eda,naja wir haben seit frieden,0
deu_c4ff40aa9c84580fba20f991ad6668ef,weil die israelische besatzung von palästina halt ein kriegsverbrechen ist igh bericht weil israel palästina besetzt inclusive gaza igh bericht und wissenschaftlicher dienst des bundestage und besetzte haben ein recht sich gegen ihre besatzer zu wehren weil israel palästinensern ihre rechte vorenthält das recht auf weil israel nicht unschuldig ist auch israel hat auf zivilisten geschossen israel sagt natürlich es ist begründet behindert aber jede unabhängige warum sollte hisbolla raketen auf den libanon hinnehmen,0
deu_7507a727cf25c7b5e05afb8a26f119df,archiv journalist nach pro paläsina demo mit thunberg attackiert,0
deu_782ee559752d5513822fefccf6bec5dc,die linke queer schrieb nazis raus überall,0
deu_0675ae8d00c75d6576f5c702a46cdbed,schlecht gealtert ihr kriegstreiber,1
deu_1aff6934c55d2aa46b31bca48195b335,ja die woke blase hat angst vor der trump rethorik,1
deu_fef75f215b5d7ab02f73df5bf85e6909,umgekehrt wird ja auch vieles als linksgrün versifft bezeichnet was nicht stramm rechts ist,0
deu_839f0ea9346cf91d3d18c1d3c348d9aa,was wollen ddie dann bei uns in deutschland asyl und schutz ekelhaft,1
deu_4434adc5591c6858e15d9d33d1fbe875,direkt nach gaza abschieben wenn die sich so asozial verhalten,1
deu_72f58496247d34330a43ba2be6924138,oder der im artikel genannte vorschlag der umwelthilfe schließt sie bei höheren parkgebühren ebenfalls ein achja familien vans und kombis ausgenommen die duh betont dass sie familienautos wie vans grundsätzlich nicht als suv werte aber auch hier gebe es seit vielen jahren den trend dass autos jeder fahrzeugklasse immer größer und schwerer werden,0
deu_ddc7d0d27baefb501425b087fcb22d03,gt in einer gesellschaft in der jeder für sich selbst entscheiden kann wie männlich weiblich oder queer man sich fühlt nimm bitte deinen strohmann wieder mit,1
deu_057b2b36d5192364326ef748c879e043,sagen wir mal so das immunsystem braucht auch training,0
deu_766c3d5ffea3847080f34f1cdf7db10a,du hast russland ausversehen falsch geschrieben frag mich ja wie russland nach dem krieg china daran hindern will ostrussland einzunehmen,0
deu_c1e815cf6ece1b0ea5453f4be2641db6,nein es gab eine ausführliche rechtfertigung der thailandreise durch die letzte generation,0
deu_a2af795180ba582720b62fdaf7fe5999,genau dann haben wir nämlich das gas aus der ukraine über die ukrainische pipeline gekauft hmm warte mal jetzt ergibt alles sinn,0
deu_aa062c0a9e375c1af0e522ea3cf18a9e,die überschrift ist schon massiver clickbait aber es zeigt mal wieder wie wichtig die impfung ist leider sieht man beim kinderarzt zu häufig eltern die die impfung mit den abenteuerlichsten argumenten ablehnen,0
deu_4f2149399ab22d1004f4775f0b411b64,echt mal warum sollte auch nur der russische mitlesen dürfen,1
deu_38fed2923450be94024a489bd95f9057,ich finde die fff solarcamps ziemlich cool das ist wertvoller aktivismus,0
deu_82f0277a5336d679d49b7d757719c631,das ist doch die letzte generation oder wie meinen die das,0
deu_4d33560dd1f90a9e508748a7ebc33811,ich für meinen teil ziehe einen kalten krieg einem heißen krieg massiv vor,0
deu_ee69425c813d8433d3f35665eb1887c3,am freitagnachmittag hat eine mutmaßlich russische einflusskampagne auf der social media plattform bluesky gewütet ein desinformationsexperte vermutet die russische doppelgänger kampagne dahinter,0
deu_5a687089c5957bfb1b4e256aa7950767,ja aber er blendet anders als dieser das umfeld aus in dem die verhandlungen stattfanden,0
deu_97ad3ebd37557a3f24e2e82e18d4400b,das gespräch hatte ich letztens erst mit einem jetzt bekannten um wirklich zu fair zu sein in einer kategorie müsste man tatsächlich zwei neue kategorien im leistungssport schaffen transfrau mann so zumindest das ergebnis der bier geschwängerten diskussion,1
deu_868297cc4ff89d052916a64fac3edf4f,schocks aufgrund des ukraine kriegs,0
deu_b87eb8c68eb6488566ab36a91ae7d3e0,die ukrainische säbelfechterin olga kharlan hat doe bronzemedaille gewonnen es war die erste medaille für die ukraine in paris,0
deu_5ec121f2b8440824ce3e4459de55a2e0,die einzig wirksame verteidigung für israel ist die vernichtung der hamas die politik der israelischen regierungen der letzten jahre hat halt die hamas erst hervorgebracht ohne freiluftgefängnis gaza gäbe es keine hamas,1
deu_0524832caf513ced6fbe7a6f248cbcc6,die meisten flüchtlinge sind alles andere als woke und links,1
deu_39137a39e3df2cd6974be72dff7025a6,vor jahren war da war das türken thematik schon lange gegessen und meine,1
deu_fb80228e7c8a0080fb07cb5451ac0648,zack bumm russische propaganda war ja einfach,0
deu_df90d0c6eb889a52ebaf81c2e04da242,russische regierung schreib das auf schreib das auf,0
deu_4fddada15f6e99ff6eb6b0d1e8a5b83d,her daddy putin approves,0
deu_2aa5cdbe325bc678b97157949f80e01e,schuldenbremse und schwarze null entspringen ja auch der gleichen ideologie,0
deu_b7ae639803c6daac1042663828b8072d,bda wenn der virus bock auf dich hat und ihr zusammen wohnt ist es eh komplett egal wer wo schläft,0
deu_95ff619e919004334dee20e6a19b7c37,für die lokale querdenker demo braucht es ein großes auto an dem man viele plakate mit fragwürdigen inhalten anbringen kann quelle thüringen,1
deu_1ced0f9ac89b1623b1dc07604e899d0f,und wie passt das dann zusammen mit der tatsache das israel bereits in mit der ethnischen säuberung der araber angefangen hat,1
deu_0addeca1c62824f72265a86a3964c5fc,kinder können da auch angezogen spielen duh wenn es so wäre wie du sagst hätte das schild sicherlich anders ausgesehen,0
deu_a657c76ff724faea6ebbadccceabcfd8,wann demo gegen correctiv wegen volksverhetzung,0
deu_0fb8268c7921e909577428aa8eb4cf57,kein linksgrün versiffter muss betonen das er linksgrün versifft ist klingt stark nach afd uboot evtl auch mal den tweet lesen und verstehen jeder linksgrün versiffte befürwortet tote faschisten über lebende und potenziell im amt tätige die geschichte hat gezeigt was faschisten so tun wenn man sie machen lässt,1
deu_5b06bac9aa7d20fe6e293d0b130d805c,woke ist das nazi der rechten,1
deu_47437b4dd621f31cd67c79840bd0e451,lacht in todeskorps von krieg,0
deu_3ea2a376a110506737f7cb61b5cbbe0c,vielleicht weißt du es nicht aber die bibel ist nicht der koran das christentum nicht der islam im christentum gibts keine scharia im islam ist die aber aber so wichtig wie das bgb,1
