id,text,polarization
deu_930f57d8ab8cf725ae17479797c840df,krieg ist krieg und wenn s blöd läuft stirbt man,0
deu_967b36e1d9ca95355caaff9adfa4aa5d,wieso lasst ihr die impfung nicht im impfpass nachtragen kann ja gut sein dass dein kind geimpft aber die impfung nicht eingetragen wurde,0
deu_9830c52c3b5509c715d264ee2ac5a3c6,der grüne michel verbrennt gebundenes co,1
deu_2f3e552a3abe1a0f9e3eb72420ccecf1,ich habe mal eben nach feyenoord hamas gesucht und da tauchten noch zig weitere artikel auf da tottenham in dem einen hier verlinkten artikel erwähnt wurde da gibt es dann oder gab das buch in dem ich es gelesen habe ist etwas älter auch diese zischgeräusche in spielen gegen die mannschaft und dazu den ruf adolf s coming for you,1
deu_764ff6e350ca05c11922a75e6af15d6d,ob man diese weltanschauung jetzt woke progressiv linksgrün postmodern identitätspolitisch kulturrelativistisch oder sonst was nennt ist völlig irrelevant es beschreibt alles die gleiche ideologie am einfachsten wäre es natürlich wenn es eine eigenbezeichnung geben würde gibt es aber nicht in ihrer überheblichkeit stilisiert diese ideologie sich einfach als die richtige seite also als die gerechten vernünftigen wissenden usw,1
deu_74f359fd2babfaafcdff2a76a41103c8,duh wie soll man denn sonst den markt schlagen,0
deu_e8b63053e83e67347020bd69947e55d8,wirklich du willst hier gerade hamas und hisbollah verteidigen,1
deu_4f4101f585853371f2b46a550c27915a,bei großzügig berechneten monat an ausgaben für einen flüchtling könnte man denselben flüchtling hier jahre versorgen total absurdes gesetz das dem asylbewerber schadet das der gesellschaft schadet das den staatshaushalt schadet das den menschenrechten schadet und alles nur weil konservative ihre fremdenfeindlichkeit ausleben wollen,1
deu_5ba643d764d1f0c9d1d23949fc999fc7,toxisch hat mich immer subtil dazu gebracht dass ich dachte das problem wäre ich dass ich eigentlich gar nicht gut genug bin hab dann irgendwas gesagt was ihn dazu bewegte mich wutentbrannt abzuservieren halbes jahr später schrieb er mir dann es war die dümmste entscheidung meines lebens dich zu verlassen worauf ich antwortete duh und ihn geblockt hab,0
deu_a0adf7790f743f19ed6cb007c8e0722c,man muss ja wohl klarstellen dass das eigene kaninchen eins von den guten und kein faschist ist,1
deu_902ec79da1d745c147ff74f15fa0857d,fragen an die letzte generation,0
deu_7667d02f30e56bc204f16c0ef96ba439,ich frag vorsichtshalber mach ihr meint die russische breitspurbahn,0
deu_217797ad652e565ff71aafea5ba3bb6e,tja das stimmt nur dumm dass die dumme masse sich von der boulevardpresse soweit hat manipulieren lassen dass jetzt alle menschen die sich in irgendeiner weise für umweltschutz einsetzen mit klimaklebern über einen kamm geschert werden das war ja auch der plan umweltschutz als solchen lächerlich zu machen,1
deu_36825b43befd9794cc5acdd0fca73b3d,streifen über getöte kinder,0
deu_38b7d00c509616707b264da2896f1086,so funktioniert das immunsystem nicht das muss man nicht trainieren man kann eher von einem erreger ausgehen der dem körper neu ist,0
deu_37e072ce102b09b40f7e82e32dc71912,wenn du die musik an sich nicht magst dann ist das ja ok jeder darf ja nen eigenen musik geschmack haben aber mit dem ausdruck dritte welt musik ist das ein klares bda,1
deu_d9946dc53965507de7902c60d8c5d447,das beispiel hinkt halt weil die muslime das ganze gebiet halt ein paar jahrhunderte zuvor erobert haben,0
deu_82901166cb11e5e1b30a0e1f5a00000c,aber aber das ist ja die pöhse grüne ideologie,1
deu_00c4f89fc4f6d14e95e00b56e7cda3df,der typ gefährdet menschen und op fragt sich ob man petzen darf soll das so eine querdenker interpretation von grunrdechten sein,1
deu_794368f7f2b9af1fd613371d4ea5c6e7,um das geht s doch nicht oder verstehe ich das falsch wenn eine formulierung vom gericht als hetze anerkannt wird dann sollte das doch unabhängig vom politischen inhalt passieren also entweder ich darf alle kriegstreiber nennen oder niemanden,0
deu_836edd579cf8f8722e7f884b62c77a38,der staat palästina ist nicht gleich hamas,0
deu_d6a491142480ddfeb713aa45524db57c,alles linker als faschist ist ein no go s falls nicht obvious genug,0
deu_d6dce4e4a807ee35cea97891f0e0d708,ja schon aber man hat am anfang noch nicht wissen können dass es so kommt in dem moment wo man mit der impfung soweit war gab es mutationen gegen die die impfung nicht so gut wirkt,0
deu_0c559bfa1173d4432f75a47cc59a6305,was für ein test corona test,0
deu_9db374784d96c5a3f4434e230969d692,zuhause im bett mit corona,0
deu_a3fa61acd31db60b9ebd2fa3dafe74c3,gerade so typen wie diese kann man aber zurückgewinnen bestenfalls ändert der sein verhalten nachhaltig oder lernt zumindest die fresse zu halten wenn man diese reue nicht annimmt kommt ganz schnell der richtige vollnazi und lockt den mit siehst du wie die ganzen linksgrün wokefaschisten dich canceln du hast doch nix falsch und schwupp landen die richtig tief im braunen sumpf weil sie sich verstanden fühlen da kriegst du sie dann gar nicht mehr raus,1
deu_bcff1bad8fd8fb4578595519d28440e9,die wechseln dann alle zu gender studies und zack boom bachelor,1
deu_1408219353978f7e234af03503a9b34b,ukraine should at least have access to the same weapons as russia if russia uses cruise missiles ukraine should get them too if russia uses cluster ammunition ukraine should have tge choice to make use of them too,0
deu_10381372880d98292fc42c519ac81d67,aha und die klimakleber mal wieder nicht typisch woke regierung,1
deu_3eb58ddf9f17edaf3e864b5998b833a1,mal nachgelesen was öffentlichen frieden stören heißt,1
deu_cab9f963edd514191f9cb038c3f0c3d6,jede antisemitische bewegung der geschichte hatte juden in ihren reihen,1
deu_25504f38c5ef9da5cd501d07a6eae620,ja das macht man normalerweise am ehesten wenn die person queer wirkt bzw man sich eben nicht sicher ist,0
deu_73c78953fe67e027febcd831a523e9bc,ich bin ein einfacher mensch und verstehe nur einfache worte heißt das ich darf mich nicht mit israel solidarisieren weil auch israel scheiße gebaut hat,1
deu_bfe2c9d549fb172b29297ad93cc788ba,ist er pro russland,0
deu_a08189cf61aea3d432af5b5852eb17be,die grünen sind extrem pro israel,1
deu_7d35a514c485973b6a550d5f5b80c82c,gt diese person lediglich irgendein beschissener krimineller der sich einbildet er könnte sich durch seine geschlechtsidentität ob nun real oder nicht aus der verantwortung für seine tat stehlen ist ein vergewaltiger der die community ausnutzt nicht der vergewaltiger schönes misgendern oder darf man menschen die man nicht mag misgendern oder welches kriterium erfüllt die vergewaltigerin nicht um als transfrau zu gelten,1
deu_97caf29eecfa9b76747a371834894493,redet von realismus fällt aber auf offensichtliche russische propaganda rein,1
deu_b0f495a8c0fbfb6bd5ac8bff63d6bd5b,laut umfragen ist das wichtigste thema von afd wählern weiterhin die migration,0
deu_f8b1c6d56815c2a08da70c859560607d,ukraine russland konflikt zu gefährlich nach russland zu fahren,0
deu_5839352383ada7af45ec29b2bdf048dd,pistorius war zumindest mal beim bund,0
deu_1d216a97883db35979e64f9e65ddaef1,seltsam röntgen zur altersbestimmung bei asyl forderer ist,0
deu_faccd83bb5667525dd413bb9da5322db,bei dem woke trend auch gefühlt,1
deu_79b440cbd6d6b2f2d5535eee268e1cf7,russische infrastruktur nicht unsere infrastruktur die pipeline gehört russland,0
deu_0e7a793cf3394305c0c0a50da4238a90,frieden durch überlegene feuerkraft,0
deu_199121ea7b51105a8124142af009903a,zu weich wahrscheinlich hauptsächlich beim thema migration,1
deu_57d22549fe8d27696f15ef9c20298a00,und wie bekommt man die hamas dann,0
deu_5db98fed3c20dd2024a4af713358e33d,deshalb eine ordentliche co steuer,0
deu_8c6155dacb9455aad66b63a50c92f243,all in ukrainische agraraktien mit hebel,0
deu_1bd46688a1f1a720d819da3f03a6a56b,der islam steht für frieden bro,1
deu_331eae0964dde0839519bf0eff4bc3a3,hat die aktivistin ausländer zusammengeschlagen,0
deu_93b056357df6f649a8eaf5d457ff7299,deine mehrheitsgesellschaft ist gar nicht adressat der fff forderungen sondern die politischen entscheidungsträgerinnen insofern kann deine mehrheitsgesellschschaft gern weiter layla hören,1
deu_5172fcfcdb66ca73fe2a0f7e26203e94,und wieviele von denen haben verbindungen zu hamas und hisbollah,0
deu_55fce0a01520c7f9d520c384fe40a2e3,wenn man westwood studios glauben darf würde stalin ein wesentlich schlimmerer kriegstreiber und diktator,1
deu_62435aa3c5fcec3078c5c4fded7c76f0,sind die biontech gründer mit der impfung weiß geworden,0
deu_b7f874bb22626b1ec6fca12e72602a2b,mit der deutsch sowjetischen invasion polens wurden viele kontinente in den krieg gezogen japans krieg blieb vorerst nur in asien,0
deu_60e2522f1378d776a29b194e61f70350,warum nuked die usa nicht direkt moskau,1
deu_03f3a395fc8d06b71ef4c63806f05fa5,hisbollah beschießt israel mit tausenden raketen also ja israel darf sich und sollte sich auch wehren,1
deu_864cf25bd250ab931a76af3379d8f30c,das ist kein protest das ist sinnlose sachbeschädigung und sollte hart bestraft werden,1
deu_9f27dfb81bea51c1d6e86cac1050da54,firmen weltweit wenn sie co zertifikate anbieten,0
deu_8aef24b32610ac93ac1a0e873ea45c00,du meist als die araber der un teilungsplan für palästina nicht akzeptiert haben und dann die juden zurück ins meer treiben wollten,1
deu_e437eccb34ad4dac180f57a10b2748d0,uran kommt zu großen teilen aus russland und dem total von russland unabhängigen kasachstan,0
deu_f178abb2b33ba625ba38121f7ba45842,juden und jüdische organisationen sind von kritik nicht immun er hat ja nicht pauschal juden oder jüdische organisationen angegriffen,0
deu_18168c3fb9966e652cdf3210a586cf69,gender sind soziale größen und keine biologischen daher sind gender soziale geschlechter und keine biologischen,0
deu_9bd41e8f9b3c97a59c01256eddfffc7b,die letzte generation hat farbe auf dem display verteilt,0
deu_4cc3825d5be093563f6a3a2475bdd4c0,wir haben milliarden für u boote nicht aber für neuen wohnraum oder frauenhäuser verkehrte prioritätensetzung der kriegstreiber muss weg,1
deu_7596f52ef4a9943503af1cd22f744f99,haha what nein warum sollten wir co emissionen senken und keine co emissionen exportieren würde doch reichen,1
deu_4cb067932e6e50aaab8a14a4b14a8b69,ich krieg mich nicht mehr,0
deu_156152677ff5b7317cbb32cf627dd5a1,just buy a house duh,0
deu_ade500fe7f10ccb1b83122b8007e1e00,whatabout cum ex und masken und covid tests ü,0
deu_bf86e8aeb64d412f4a839c6dad76c51b,die jüdische ecke und der zentralrat der juden haben ofarim für seine aktion stark verurteilt und die vollständige rehabilitation des managers gefordert,0
deu_dece2ea5d07bf3f8c77348a5d9133e9d,schon sehr bald wird sich donald j bei seinen hasstiraden gegen wolodymyr so hemmungslos wie dmitri gehen lassen,0
deu_a75bf822ed4229b5d09184f60d9e7c5e,vor corona vielleicht ja nach dem corona und ukraine sicherlich nicht,0
deu_b35883720f6497f58f562e2e81ee5aaf,du hast vor corona gekauft,0
deu_e8cc505c2588b66fbe88c1359c1cf935,denkmäler zerstören und leute verprügeln gilt also als demonstration,1
deu_4e57a543a17857e674bc68e5c085ad9d,körnerbrötchen fahrradweg windrad und kein islam appeasement es könnte so schön sein,0
deu_e829b9f214b3cb58c536ce3d4f21d1af,in nrw funktioniert schwarz grün unter wüst sehr gut und völlig geräuschlos mit ihm wäre es eine option im bund mit merz und migration migration migration linnemann wird es schwarz braun geben,1
deu_ee0016806446081e1fe8e8e87d64ce59,oh nein die grenzbefestigung angreifende männer die bestimmt nicht zur hamas gehörten was hamas hat deren beteiligung sogar bekanntgegeben komisch komisch komisch,1
deu_fa9e241096add87f951ca6c4c5c67c1a,ja du pflasterst aber hast wenig mit umweltschutz zutun,0
deu_8676f4d8469505b4c4de33a47c7780fc,blödsinniges argument wäre genauso zu behaupten dass jeder der nicht grün gewählt hat sich nicht für umweltschutz und klima interessieren würde wobei der zusammenhang zwischen grünen und umweltschutz wieder ein ganz anderes thema ist,1
deu_798c5dd28ffcb82b3d1c875d4196ed43,glaubst du der kann so lange weiterregieren wie er lustig ist das ermächtigungsgesetz hat ihm der supreme court ja schon im frühling geliefert,0
deu_424e93bc0ff2c9de35d1ff9e6280afd1,ich frag mich wieviel geisel überhaupt noch leben,0
deu_1d4da7e4b7a85bdb96252ba05522f17f,nda bei dem was du schilderst bekomme ich echt einen kotzreiz gut dass du dich getrennt hast bist du überhaupt flüchtling oder hat sie das einfach erfunden in ihrem dirty talk in jedem fall absolut widerlich den partner so niederzumachen in welcher welt soll scheiß flüchtling lustig sein,0
deu_9ec813a891c3e193c28b9705be895102,putin scheisst auf sein land,1
deu_cb955d41f2759a890066e24df2312b0b,putin hold my wodka,0
deu_3587eda975376f58459f997887923cd8,das öffentlich zu diskutieren ist doch nur panikmache der linksgrün versifften s,0
deu_25f7d3d3db27a9156b75dbe31f350467,dritter knopf endlich kann man über den türken schimpfen,1
deu_651cafe3e509394cdade7b90f2f3524c,wenn du einen schnitt hast und ins krankenhaus gehst wird eigentlich immer eine impfung mit antikörpern gegen tetanus verabreicht das ist etwas anderes als die impfung mit tetanus antigenen die deine gedächtniszellen impft,1
deu_9b1f81809ba4c79f9a5ee5f0377c7645,lies weniger russische propaganda,0
deu_3b933531ad07fc41192102fb3d9592bc,mathe klasse minus und minus ergibt plus anti anti faschist die antis hebeln sich gegenseitig aus was übrig bleibt ist faschist sorry not sorry,1
deu_786367a596c90350c4de056806130b2c,krieg ich auch eins,0
deu_40c411089c8e2a5d52dd35b5ca7c7a87,ist was hamas sagen würde glückwunsch,1
deu_422a66d1843c85b5b93f09e63cff738e,funktioniert vor allem in den usa wunderbar da musst du nur laut genug darüber schreien dass eine transfrau dir die chance auf den sieg beim college schwimmevent geraubt hat und schon darfst du jahrelang durch alle rechten sender tingeln und drei bücher schreiben lassen dass du in wahrheit zeitgleich mit der transfrau auf dem fünften platz gelandet bist also von vier anderen mädels geschlagen das interessiert da so absolut niemanden,1
deu_1c1cbb96103d08365b49fb7ac412e25d,um bei den klassikern zu bleiben arthur c clarke die letzte generation,0
deu_8d7ec2b13aad71cb19b4f0adb8df8a40,waffen die frieden schaffen,0
deu_da211c0599a4106ffa63a5e75fa77ba9,hast du dir mal angeguckt wie sich der co ausstoß entwickelt ja der kennt nur eine richtung nämlich steil nach oben,0
deu_742d52c59a28302ffaca47342d3b2180,und dann sollen diese kitas auch kein ostern und weihnachten feiern,1
deu_00a18a4bc96df86c3ae95eefd1794b68,die nsdap wollte die deutschen juden zuerst nach madagaskar deportieren endlösung erst ab,0
deu_a14a813ffd7ca42e4805e424bf00e1df,in der pandemie hatten die top verkäufe wie passt das,0
deu_fc33ef8bfc489454789cea5228279bf1,die angreifer waren keine querdenker,0
deu_7aa9590741f0fdf0bd8a0cd9e0b7670f,schwach putin freut sich,1
deu_84d95a39c32a2b5397516d6e8b8f88ec,was sind querdenker sticker was steht da drauf,0
deu_6043d6bb2d181f37f35be257bd0ad865,hemdfarbe mit ausländer prügeln vergleichen genial,1
deu_df27aed452afa2c3919808a2d79c1f3d,erstmal demo gegen rechts,0
deu_a639d90ebd9b023afcd52bf0561ba2a4,nei gewichster türken kübel xd,1
deu_721c066b233d319442e64ccc25e3abd8,nein du verstehst nicht was da steht nicht das was du oben geschrieben und gelöscht hattest bestimmt wie russland reagiert sondern wie russland die situation auslegt und deutet bestimmt wie russland reagiert,0
deu_e2858d2054dfe01a87af0eacf7fdb83b,außerdem ist die hpv impfung keine impfung gegen krebs direkt sondern nur gegen ein virus das sehr häufig eine bestimmte krebsart auslöst ähnliches ergebnis aber vom angriffspunkt her keine imfubg gegen krebs direkt,0
deu_1314509508dd6793549e0c175358d699,das hatte ich schon vor covid nach erkrankungen monatelang,0
deu_f818a62749ebf27e6320680df8e69884,das sind bei zon doch nur noch russische bots,1
deu_68437f5f991ab3e475c0f64536bfa3a6,geiles asiatisches tattoo auf dem seitwärts hünchensuppe frieden mut steht,0
deu_0d659b6036cc5ae63961b3f80a910efb,bei genetik und juden wird das eis aber schnell sehr,1
deu_1e74d885bd1b5f8485552604b0b1f175,du findest in querdenker gruppen auf telegram ganze listen mit querdenker ärzten die dir sowas unkompliziert ausstellen wette damit ist man auf den arzt im entfernen bayern gekommen,0
deu_09fe60befa6492046a23d6ac1ba0e8f5,nein bundesland bund,0
deu_a851a1b8d88968989b947ea1ac5a3b0e,bda troll dich mit deiner konstruierten anti woke story,0
deu_73b53431c18da23cdee33590c1d8d67f,grundrechte können auch eingeschränkt werden und das ist hier angebracht wenn die gerichte das nicht tun dann muss eine gesetzesänderung her es geht nicht an dass wichtige infrastruktur als geisel genommen wird,0
deu_7d8bfd890173b2640968cc16fb15ebf3,ich krieg sowieso kein gehalt,0
deu_12c8b1acda4c9b5da298a46f4305fb0d,ruhe in frieden perscheid,0
deu_57c6b362eb3a1215892aa74ea2a99f2d,gegen covid geimpft,0
deu_c3e0a97ad3da515efe85cc604c9f3588,er ist team russland,1
deu_f72711040c6a24641c5530ed55c3ddab,türken haben in berlin rettungskräfte an silvester angegriffen,1
deu_be5d0c58266f060dbc3a4bacd1364792,du meinst so wie man damals im wk juden versteckt hat,0
deu_430768241e2d9ea4a845012fe88644ea,gab schon ein paar recht gute studien dazu dass die inzidenz prävalenz von long post covid wahrscheinlich massiv überschätzt wurde und wird sicherlich auch durch den medienhype association of self reported covid infection and sars cov serology test results with persistent physical symptoms among french adults during the covid pandemic flawed body of research indicates true long covid risk likely exaggerated bmj,0
deu_dc5d5fbfbd2713c836af65745f4aeed6,russland hat die ukraine aus machthunger und zerstörungswut angegriffen russland will keinen frieden russland ist ein terrorstaat,1
deu_50993e02b800428ef14e358e7b020bf8,wie werden die araber denn in israel diskriminiert ich meine die frage ernst landläufig hört man ja eher dass die kulturen in israel friedlich zusammenleben,0
deu_bd8497e40afab5b922921f08310c283a,dass ich die existenz von israel befüworte und die existenz von israel nicht gleichzeitig mit einem fortbestehn der hamas kompatibel ist,0
deu_ab82aa1eebc39259d377d0aa46f8e7fb,ich als linker und dann erstmal über regenbogenflaggen klimawandel und gender paygap herziehen genau mein humor,0
deu_cc77d69d56d15e50725aad3b1dce3734,deswegen ist der täter wahrscheinlich auch ein sogenannter flüchtling hilflos verfolgt und arm dran und so tja einzelfall latürnich passiert halt ne,1
deu_a74a04d7b99681e29746616dcbfd83d9,sind meistens die woke people,1
deu_c73517088542a7d277db783622d0f772,das ukrainische militär hat nordstream in die luft gesprengt und wir sollten dem land vertrauen,1
deu_3852d0959e2b50474874fb6561cb0fe8,natürlich darf man israel kritisieren,0
deu_d94de5c01af15f8cf9e414d300fe16e1,corona politik und arbeit manche leute bauen ihre komplette persönlichkeit auf diesen themen auf corona darf ruhig durch andere heikle themen ersetzt werden,0
deu_789b2260b5eb5d302ae30f0da0c43af9,die letzte generation ist noch eine nachricht wert die werden langsam aber sicher irrelevant,1
deu_17f8b43eb6d512ac90b72d60d6e0489b,menschen die fliegen gehören weltweit zu den wohlhabendsten wenn sie merz blockieren würden dann würde der sich aufregen warum sie nicht jeff bezoz stattdessen blockieren letzte generation hat bereits privatjets blockiert,0
deu_923927e9583ec71e36197f07ae49da0f,das ändert nichts daran das gewaltloser protest gewaltloser protest ist ich würde die selbe gewaltfreiheit über stillsitzende nazis muslime hippies fordern davon abgesehen dass proteste schon immer ein legitimes und wichtiges mittel waren,1
deu_98533d5df2af850ace07285b7e83137e,komisch das verbote ok sind wenn sie die eigene ideologie unterstützen,0
deu_ccde83f94b02ae543eda326cb7e07ea9,ist halt so ein wohlfühlargument wenn migration bzw integration hier kritisiert werden,0
deu_1580745e8dd5ea9c0681779fd8cecb0a,russische panzer rollen nicht,0
deu_d7c309609e8fa2e5f12307342eb8b4d1,muslime dürfen nicht in israel leben,0
deu_704b7ecc0887643bcbb27d3f6f466698,umweltschutz ist gut und wichtig klimaschutz ist blödsinnige panikmache und geldmacherei,1
deu_0c5f96882fb847decac02f4c0fbba803,kriegstreiber sitzt bei,1
deu_806e88ce52ea990144ce260738469a61,volksbelästigung gehört nicht zum protest,0
deu_620b8c83d6a73d6527f5b5567fbdc9ec,komisch nur ausländer oder ausländische herkunft,0
deu_a5aec6868da4c972b1a04657ae12b0ef,ja russland sollte sich endlich zurückziehen und frieden machen das ist der einzige weg für frieden,1
deu_0354af570838412a7acda1cda88161bc,scheiße die meine partnerin und ich abbekommen weil sie eine transfrau ist,1
deu_a65bd83363c510e8b250031ea22ef314,ging es in dem anderen thread um den protest oder darum dass jmd bei dem protest angefahren wurde klimaaktivisten umfahren damit die mehr reichweite kriegen jeder hat was davon s,1
deu_cfd663e7413157bc37037e3d31ca6050,wurden bei der mobilisierung sanfter behandelt passt doch,0
deu_b84912cbd48aee1aafd3a48756718d39,die intelligenz vieler schwurbler die vor covid noch anders drauf waren nach covid auf einmal versteher für alles,1
deu_48c1049033a1ae2540cf9235f3871a93,willst du einen krieg gegen russland kämpfen ich nicht zu sagen wir sind im krieg mit russland ist hochgradig gefährlich,0
deu_c4b0650396a15542daf3c2abb34c73cf,genau einen monat nach kriegsbeginn fährt paul ronzheimer als erster deutscher reporter mit der israelischen armee in den gaza streifen in beit hanun wird in unmittelbarer nähe gekämpft hamas terroristen greifen aus einer schule heraus an sehen sie die hier den exklusiven bericht aus gaza min artikel,0
deu_3457a7b2979a24021d97a8b2004acd52,so wird das nur nichts mit frieden auf der welt es wäre putins frieden derselbe frieden mit dem putins einfall in der ukraine begann bereits war ihm das genug warum sollte es der fall sein wenn wir ihm die ukrainer zum fraß vorwerfen,1
deu_fc189afd27ec6d3a40f63d652ce663cf,was bringt ihm eine impfung wenn er bereits erkrankt ist,0
deu_3484e51d823537a701da8f6e1e7b0a25,des steht für mich schon fest glättung,0
deu_c7e3d99bcf8cdb95a3b4421a2cdf3feb,weil die ukraine eine perspektive braucht,0
deu_079170b6f867a8b4512f6266a0e9dc97,dennoch stammt es aus einer ideologie mit grundlegenden faschistischen werten,0
deu_782c33b348367e41a640d4b44417f2ea,direkt abschieben das pack einfach über gaza abwerfen da fühlen sie sich ja wohl,1
deu_ddca2eab1397105ca7bd8958b83b847f,wenn ich dann aber auf so eine demo gehe und mich bei den redebeiträge frage ob das eine klima oder antifa demo ist dann ist der sache damit nicht gedient,0
deu_3ccbb79a215bd5a8fe85722020cb2da6,das stimmt so nicht ganz die transfrau hat extreme psychische probleme und hat eine discordsekte gegründet im der sie sich wie eine gottheit feiern lässt wirklich komplette psychose und sie braucht dringend hilfe,1
deu_a7dc6f9ef06e6373985260ae76b50f6d,also es gibt doch keine offizielle gruppe querdenker mit statuten usw oder steh ich auf dem schlauch wenn von querdenker gesprochen wird ist doch eine arbiträre gruppe gemeint die von anderen als querdenker bezeichnet werden,0
deu_2f86ee68836f09d2703e1519e4105674,hasst alles und jeden inklusive sich selbst weil du angst vorm schmusen hast bist du ein faschist,1
deu_2712af86bd80a5de85486b2c3beb8636,bist du auch pro hamas,0
deu_5d9a31970be8f71419277258e1b862f5,das der moderator dieser polit sendung mit der hauptorganisatorin von fff liiert ist hat auch ein geschmäckle,1
deu_39cc883673dfb1efc0aa43c9a5d9c1ef,rp die russland partei,0
deu_23e9afcac22146c984796032951df5b0,fragen schämen sie sich nicht für den tod junger menschen jeden tag den sie in klassischer kriegstreiber manier befürworten schämen sie sich nicht für das blutgeld in ihrer tasche welches sie als rüstungslobbyistin schön wohlhabend macht danke,1
deu_3d3c22224639ccabdc69afca82dec507,woke ist wenn hitler verharmlost,1
deu_a218d4f3fd18019df0541ad57ceb0d39,warum ein bekenntnis israel zu israel zum gg und zur freiheitlich demokratischen grundordnung würde viel mehr sinn machen,0
deu_613228a2eb81f03db0f9c6b67aebcd22,türken die pizzalieferdienste betreiben,0
deu_ba386543a998081ea34b63033146eb20,wie wäre es mit einer anerkennung des holodomor als völkermord an die ukrainische bevölkerung von seiten russlands,1
deu_60761ceae40827030a1ee6c7f19b04bc,facebook mutterkonzern meta sperrt russische medien rt und andere russische staatsmedien sind weltweit von facebook instagram und whatsapp verbannt worden der us mutterkonzern meta will damit gegen desinformation und russische propaganda vorgehen auch der us wahlkampf spielt eine rolle desinformation auf x russische kampagne aufgedeckt mehr als gefälschte nutzerkonten auf der onlineplattform x mehr als eine million deutschsprachiger tweets russland soll mit einer massiven kampagne versucht haben mehr unmut gegen die ampel regierung zu schüren,0
deu_e5590d390de38cbce3d2a30c289d880a,gibt es türken überhaupt sind sie eine erfindung der großstadt eliten,1
deu_7bb1487df7836b95b51d41f70e87f5d2,wo werden menschen denn an migration gehindert abschaffung des asylrechts und pushbacks,1
deu_93dd84a6c378a9521d23d5873cfac0d0,nur norton kein russische software niemals,1
deu_e043db36fcd357ab635df4049dd38012,viele leute sehen einen klaren unterschied zwischen nur homosexuell und queer ja wegen rechter hetze ich kenne otto normalbürger die sich als queer bezeichnen aber die sind halt keine gute zielscheibe,1
deu_3103081bd7207380376a897781abc9d2,rechter geistiger dünnschiss findet immer einen grund den örr als linksgrün versiffte propaganda hinzustellen,1
deu_ea10d6e61ced0af1d0f787677b9a01c5,weil der durchschnittliche dezwo nutzer nicht in seiner eigenen ideologie feststeckt,0
deu_80a958d1ba7f7a63a400e671e195bdd1,waren wieder russische fischer in der nähe,1
deu_859759059ac3df85dba612448a2c6501,zwei der drei starbucks gründer siegl und baldwin waren auch juden es kann also wirklich ganz platter kauft nicht bei juden antisemitismus sein,1
